cluster,x,y,nr_users,nr_books,cluster_title,cluster_description
128,553.6168224299065,576.3084112149533,34,107, Journey Through Art History: A Tapestry of Cultural Eras and Artistic Conversations," This cluster of books from an art history library weaves a rich mosaic spanning centuries, from the classical grandeur of antiquity to the ornate expressions of Baroque, unearthing the evolving dialogues between art, power, and society. It delves into the opulence of Byzantine ecclesiastical artifacts, scrutinizes the political symbology of Papal reigns, and chronicles the influence of the Medici. Each title offers a glimpse into the sacred spaces, architectural marvels, and aesthetic revolutions that have shaped our visual heritage. From the individual genius of artists like Alonso Cano to collective expressions of cultural identity, this selection is an intellectual odyssey through the multifaceted realms of art history."
129,531.2,573.1090909090909,11,55, Chronicles of Artistic Legacy: From Medieval Mastery to Renaissance Revelation," This collection delves into the rich tapestry of art history, capturing pivotal moments from medieval artistry to Renaissance innovation. The cluster explores a myriad of topics including ""La pelle di San Bartolomeo"" and ""Judas beim Abendmahl,"" manifesting religious narratives and iconoclasm that shaped artistic themes for centuries. Manuscripts and biographical accounts such as ""The Italian manuscripts in the library of Major J. R. Abbey"" and ""Le vite dei più eccellenti pittori, scultori e architetti"" offer insights into the provenance and lives of influential artists. ""Art auctions and dealers"" exposes the commerce of art, revealing the market's evolution over time. Other titles focus on specific genres like landscape portrayal in ""Naissance et renaissance du paysage,"" while ""Raffaello e l'incisione"" and ""The paintings of Domenico Veneziano"" highlight the contributions of individual masters to technique and style. From the theoretical ""Theological aesthetics after von Balthasar"" to the technical ""Atlante delle tecniche costruttive,"" the array bridges the gap between philosophical discourse and practical craftsmanship. This curated selection of texts invites readers to traverse the corridors of history, witnessing how art and its reflections of culture have been etched into the very fabric of society."
130,358.4561403508772,456.8070175438597,14,57, Artistic Intricacies: European Art and Cultural Identity from the Middle Ages to the Renaissance," This curated collection of art history literature explores the profound relationship between art, culture, and society in Europe from the Middle Ages to the Renaissance. Spanning Italian masterpieces, Venetian culture and bookmaking, to the musical influences in art and the symbolisms within, these works unveil the intricacies of aesthetics from various vantage points, including politics, philosophy, and religion. Insights into the iconography of funerary architecture, the impact of travel on artistic perception, and the rich dialogue between painting and music are comprehensively covered. The compendium offers a multifaceted look at the development of European art, from the Doges of Venice to the courts of Henry VIII, highlighting the works of Bellini, Dürer, Holbein, and Leonardo da Vinci. Piero della Francesca's mathematical approach to painting and the artistic contributions during transformative years like 1492 and the Renaissance period further illuminate the evolving European cultural identity."
131,335.6984126984127,452.6190476190476,9,63," Reflections on Art: Wanderlust, Wisdom, and Wonder"," This curated selection of art history texts, 'Reflections on Art: Wanderlust, Wisdom, and Wonder,' embodies the amalgamation of aesthetic appreciation and scholarly investigation. Spanning from explorations of Genovese slavery and Ottoman influences ('Schiavi a Genova e in Liguria', 'Turcherie') to the focused studies of artists such as Salvator Rosa and era-specific artistic tendencies ('Bernardo De Dominici e le vite degli artisti napoletani', 'Old master paintings'), this compilation traverses the intellectual landscape of the European artistic heritage. It reflects on the profound connections between travel and art, as evidenced in the journeys of English travelers and Leibniz's Italian itinerary ('Viaggiatori inglesi in Italia', 'G. W. Leibniz: Iter Italicum'). Themes of identity, self-portrayal, and the symbolic power of masks ('Identität', 'Die Paradoxie der Maske') are considered alongside meditations on the mirror's role throughout history ('Histoire du miroir', 'Du miroir au selfie'). The collection probes the intersecting realms of literature, philosophy (highlighting Vico), and artistic innovation, delving into the luxuries of early modern Europe, the paradoxes of images, and the shimmering allure of material culture ('A taste for luxury in early modern Europe', 'In Bildern denken?', 'Shiny things'). This cluster invites readers into a multifaceted dialogue where art entwines with broader cultural and intellectual currents, mapping the odyssey of human creativity across time and space."
132,584.728,550.832,48,125, Reflecting Heritage: An Eclectic Tapestry of Art History," This cluster of art history books paints an intricate portrait of cultural heritage, ranging from the splendor of Italian art in the time of Pope Pius IX and Marquis Campana to the nuanced brilliance of Flemish and Dutch painters of the 17th and 18th centuries. It dives into the crossroads of civilizations like Antioch, the spiritual landscapes of Armenia, and the festive aesthetics of Christmas. Highlighting conservational ethics, the contested art of Napoleonic times, and the legacy of influential architects and artists, this collection also unfurls the threads of religious artistry, preservation sagas, and the evolution of styles from the Middle Ages to the Renaissance. Landscapes, both real and imagined, play a pivotal role alongside the detailed narratives of doges' tombs and Sienese baptistery fonts. The breadth of insights offers a magnificent panorama, encompassing scholarly studies of figures like Velázquez, Courbet, and Dürer, and their imprints on European cultural tapestry."
133,580.3272727272728,581.1454545454545,40,110, Reflections of Culture: Art and Identity Across Time and Space," This cluster of books represents a deep exploration of art history, culture, and identity as they have manifested across various time periods and regions, from classical antiquity to modern Europe. Touching upon themes such as the philosophical notion of emptiness in 'La densità del vuoto,' the intricate play of emotions in Renaissance Italy, and the architectural grandeur of 'Die Dresdner Frauenkirche,' the collection examines how artistic expression is intricately linked to societal change. It delves into the heart of Italian cities and the waning influence of the Mediterranean, illuminates the dark corners of history through art anecdotes, and traverses the spiritual realms with studies on prophecies and religious iconographies. By compiling auction catalogs, inventories, and personal testaments such as 'I testamenti dei cardinali,' the cluster becomes a repository of personal and collective memory. It challenges readers to contemplate the mirror of history through art, from the idealized visions of neo-classical taste to the preservation dilemmas facing 20th century architecture, encapsulating the breadth and continuity of the human struggle to shape and understand our world through the lens of art and history."
134,499.7352941176471,300.2450980392157,31,102, Foundations and Flourishes: A Survey of European Architectural Past," ""Foundations and Flourishes"" unveils the splendor of European architectural heritage, spanning the historical landscapes of the Renaissance to the Enlightenment. This curated collection includes thorough studies of palaces, such as the Clam-Gallas Palace, alongside profound examinations of religious structures, symbolized by Bavarian church blueprints before 1803. It reflects on architecture's role in society, delving into Jesuit influences in Vienna and the structural narratives of cities like Venice and Vicenza. Through biographies of visionaries like Welsch, Zuccalli, and Fischer von Erlach, complemented by analyses of the Quattrocento church and reflections on architectural mimicry, the collection offers a rich dialogue between tradition and innovation, encapsulating how landmarks are woven into the cultural fabric. Insights on specific structures, from San Pietro di Spoleto to the Palais Daun-Kinsky, are juxtaposed with intellectual treatises like Wren's writings, embodying the multifaceted nature of European architecture and its profound impact across centuries."
135,472.96629213483146,313.6966292134832,14,89, Cultural and Artistic Heritage in Emilia-Romagna: From Restoration to Revelation," This collection delves into the diverse cultural and artistic landscapes of the Emilia-Romagna region in Italy, from the Renaissance to the 18th century. It includes studies on restoration projects (""Ritrovamenti e restauri""), Jewish heritage (""Le sinagoghe in Emilia-Romagna"", ""Museo Ebraico di Bologna""), and the influence of significant art movements and artists (""L' arte degli Estensi"", ""Guido Reni e i Carracci""). Themes of religion and culture interlace with explorations of local history and institutions (""I Cappuccini a Modena"", ""Il papato e il processo ai templari""). The cluster also focuses on specific artistic expressions, such as drawings (""Old master drawings"", ""Disegni bolognesi e veneti"") and prints (""L' immagine a stampa di San Luigi Gonzaga""), offering insights into the evolution of art and its role in society. The inclusion of titles about secular and sacred architecture (""Il Palazzo dei Mansi in S. Pellegrino"", ""Nel segno di Palladio"") and the biographies of Bolognese painters (""Vite de' pittori bolognesi non descritte nella Felsina Pittrice"") enriches the narrative by presenting a holistic view of the region's contributions to world heritage."
136,477.9,338.0,19,70, Reflections of Italian Art and Architecture: From the Renaissance to the Baroque," This collection offers a comprehensive journey through several centuries of Italian art, highlighting the Renaissance and Baroque periods in particular. It features Vasari's seminal work on the lives of artists, scholarly research on sculptures and drawings in Bologna, Emilia, and Naples, as well as focused studies of cathedrals, palaces, and monuments across Italy. Thorough guides to the Vatican's Pinacoteca and the famed Galleria delle Carte Geografiche present the papal impact on the arts. Architectural treatises on bridges and public works sit alongside deep dives into the water's cultural role. Within these books, names like Domenico Fontana, Jean de Bologne, and the Gagini family emerge, underscoring their lasting contributions to the architectural and sculptural heritage of Italy. This cluster reveals the layered relationship between art, history, and regional identity across Italian territories, while also exploring the influences of Greek and Roman heritage and the legacy of artistic professions from the Middle Ages through the 18th century."
137,653.0340136054422,771.0340136054422,133,294, Diversity in European Art: A Historical Panorama," This collection encapsulates the multifaceted nature of European art across centuries and regions. ""Diversity in European Art: A Historical Panorama"" offers a comprehensive dive into artistic development, covering Italian landscape painting, Ottoman influences in Venice, Victorian perspectives on Italy, and scholarly contributions to art history. It includes studies on specific art academies, like Carrara, examinations of cultural shifts within church reform, and the contributions of noble families to the art world. The cluster traverses geographical boundaries, from the reaches of medieval Constantinople to the watercolours of Britain, and addresses the evolution of art from antiquity to the 19th century. It highlights the intersection of elite and popular culture in Alpine areas, delves into religious controversies, and commemorates the significance of art movements and figures like the Medici. This curated ensemble of texts provides a rich mosaic reflecting the intricate and far-reaching narrative of European art history."
138,360.6875,587.84375,16,64, Echoes of Antiquity: Exploring Artistic Heritage Across Cultures and Eras," This collection of texts offers a deep dive into the rich tapestry of artistic expression, spanning medieval techniques and ornamentation, liturgical traditions, and the intermingling of different cultural aesthetics. It encompasses diverse themes such as 'L' oreficeria d'Oltralpe in Italia’ exploring cross-cultural influences in jewelry, 'The art and architecture of Islam' delving into Islamic art's impact, and insights into acting from ancient traditions in 'The art of acting in antiquity'. With a focus on manuscripts, metalwork, and monumental art from various regions such as Italy, the Iberian Peninsula, and the Islamic world, the collection underscores the evolving dialogue between materiality, sociology, and technology in art history. This thematic convergence highlights the synthesis of Byzantine, Norman, and Arabic influences, particularly in the Mediterranean, and invites contemplation of art's role in shaping communal identities and religious practices throughout the Middle Ages and beyond."
139,432.0919540229885,602.0689655172414,29,87," Echoes of Medieval Memory: Art, Architecture, and Pilgrimage"," This collection weaves together the multifaceted threads of medieval culture, faith, and artistic expression, illustrating how the period's aesthetic and religious practices were inseparably intertwined. Exploring various dimensions—from the Byzantine Empire's visual heritage in 'Studies in Byzantine painting' to the poignant narratives of devotion along the pilgrimage routes to Jerusalem and the Gargano in 'Fra Roma e Gerusalemme nel Medioevo'—this cluster delves into the shared human experiences of memory, journey, and sanctuary. It spans across examinations of common clergy life in 'La vita comune del clero nei secoli 11 e 12', analyzes the dynamics of religious spaces like 'La basilica di San Lorenzo in Milano', and uncovers the role of art in public piety through titles such as 'Napoli - la Cappella Sansevero'. Moreover, it contemplates urban religious spectacles in 'City and spectacle in medieval Europe', captures the spirit of religious celebration in 'Istoria degli anni santi', and affords a glimpse into medieval Neapolitan culture with works like 'Statue vestite e snodate'. This curated assemblage extends an invitation to comprehend the enduring legacies and the intricate fabric of medieval religious life and its rich artistic landscape."
140,372.2,568.0666666666667,15,75, Architectural Echoes of Empires: A Study of Construction and Artistry from Antiquity to the Ottoman Era," This collection from an art history library encapsulates a rich tapestry of architectural and artistic endeavors spanning various eras and regions. From the fortresses of the Crusades & Italian mosaics, to the grandeur of Roman villas & Pompeian frescoes, each title reflects a commitment to exploring the context and craftsmanship of historical edifices. The cluster delves deep into medieval structures, Byzantine influences, early Islamic art, and the intricate mamluk architecture. Further, it investigates secular and sacred spaces, with a focus on the potent mix of power, religion, and culture that shaped their construction, providing a comprehensive panorama of the enduring legacies inscribed in stone and mortar."
141,358.32835820895525,554.3582089552239,16,67, Illuminating Medieval and Gothic Splendors: An Art Historical Journey through Ecclesiastical Architecture," This carefully curated collection unpacks the intricate tapestry of Medieval and Gothic ecclesiastical architecture across Europe, reflecting nobility, religious institutions, and communal identity between the Middle Ages and the Renaissance. From the civic pride encapsulated in the Duomo of Pisa to the Gothic marvels of Cologne's cathedral, each book offers insights into how churches and cathedrals functioned as both spiritual havens and symbols of power. It explores archival treasures, innovations in construction, and sculptural masterpieces, mapping ecclesiastical art's evolution and its socio-political role. The cluster invites readers to delve into the profound interplay between faith, art, and community that defined an era's monumental splendor."
142,545.3972602739726,335.013698630137,13,73," Reflections of Artistry: Masterworks in Drawing, Architecture, and Iconography"," This curated collection from an art history library explores the intricate relationship between architectural principles, classical drawing techniques, and religious iconography, spanning from the Renaissance to the Baroque period. With books like ""Au-delà de l'image"" and ""The language of the nude,"" the cluster delves into the aesthetics of representation and the human form. Works such as ""Nicola Pio as a collector of drawings"" and ""Old master drawings"" highlight the significance of patronage and collection in art historical discourse. Architectural treatises like ""Introduzione alli Cinque ordini dell'architettura"" provide a framework for the neoclassical ideals and the rediscovery of ancient principles in ""The idea of a universal architecture."" Furthermore, catalogues such as ""Dessins du Musée Atger"" showcase specific collections, while thematic investigations into gallery design, depicted in ""Fate, glory, and love in early modern gallery decoration,"" enrich our understanding of art as part of cultural identity and expression. From theoretical texts like ""Neoplatonism and western aesthetics"" to referential works such as ""Lexikon der Symbole"" and ""Biblia Sacra iuxta vulgatam versionem,"" the cluster offers a comprehensive lens on the visual narratives that have shaped Western art history."
143,611.2421052631579,528.7684210526315,21,95, Legacy of Letters: An Exploration of Artistic and Cultural Manuscripts," This collection is a journey through the annals of art history, showcasing a diverse blend of manuscripts, drawings, and art from the Middle Ages to the Baroque and beyond. The cluster includes catalogs of old master drawings, studies of iconic religious scripts, and contemplations on the cross-border impact of sacred arts. It delves into the complexities of Byzantine and Armenian art, explores Italian art and architecture, and examines the intricate knot designs of antiquity. Renaissance and exilic politics interlace with the evolution of printing and the philosophy of aesthetics. The recurrent focus on Anselm Kiefer signifies a contemporary link to the alchemy of book creation, knitting the past with modern reflection. Cardinal wills and the history of religious orders provide insight into cultural heritage, while treatises on poetic and rhetorical theory offer context to the textual dynamics of times bygone. This cluster is not just about visual splendor but an intellectual odyssey reflecting how art and text have shaped human civilization."
144,591.5538461538462,521.8461538461538,14,65, Reflections of Cultural Heritage: Artistic Evolution from Antiquity to Renaissance," ""Reflections of Cultural Heritage: Artistic Evolution from Antiquity to Renaissance"" is a curated collection of art history volumes that charts the development of artistic expression and scholarly thought from classical civilization through to the early modern era. Highlights include studies on Italian masterpieces, from the romantic myths in ""Amore e Psiche"" to the grandeur of baroque in ""Italian Baroque Paintings from New York Private Collections."" The cluster navigates the intricate narratives of medieval Europe with texts like ""Profane Images in Marginal Arts of the Middle Ages"" and ""The Secret Middle Ages."" It transitions to the analytical ""Storia della minoritica provincia napoletana"" and the studious ""I parenti del papa,"" showing the interplay between art, power, and religion. With special attention to renowned figures and events, such as ""Darwin's Corals"" and ""Virgil in the Renaissance,"" this assortment offers a multifaceted perspective on the cultural epochs that have shaped Western artistic heritage. Through works like ""The Glory of Byzantium"" and the commentary on modern interpretation in ""Die Renaissance als erste Aufklärung,"" readers journey through the rich tapestry of human creativity and critique, documenting the profound influence of art over centuries."
145,513.0,350.1794871794872,11,78, European Artistic Perspectives: Baroque Excellence to Neoclassical Splendor," This cluster represents a rich tapestry of European art history focusing on the Baroque, Rococo, and Neoclassical periods. It spans influential artworks and architectural feats from 16th-century Venice to 18th-century Munich. Highlights include the Baroque influence in Innsbruck, Bolzano's artistic output, and the works of significant figures like Johann Andreas Wolff and Hendrik Goltzius. This curated collection examines various mediums such as painting, drawing, printmaking, and sculpture, reflecting dynastic power, religious fervor, and the evolution of non-verbal communication in art. From hidden masterpieces of the Hermitage to the theatricality of the Baroque and Neoclassical periods, the cluster offers a profound glimpse into the art and society that shaped these eras."
146,522.1875,366.484375,13,64," European Art Evolution: Landscapes, Ornamentation, and Influence"," This collection of texts provides an intricate examination of European art from the Renaissance through the Baroque and into the beginnings of the modern era. It embarks on a thematic journey tracing the birth of modern landscape painting with Tiziano, through the decorated intricacies of ornamentation from the 15th to the 18th century. The cluster explores the rich tapestry of Roman landscapes, delves into the works of Old Masters like Rembrandt, and unveils the art market in the Dutch Golden Age. It reveals the intersection of art and politics in times of turmoil and the progression of artistic expression encompassing engravings, sculptures, and the cultural influence of palatial art in Italy. By examining key figures and movements such as Manierism, the Winter King, and the transformation of Prague under Rudolph II, the collection offers insights into the artistic and cultural dialogs that shaped European art heritage."
147,493.0434782608696,574.9710144927536,19,69, Windows to the Soul: Artistic Journeys Through European History and Identity," This curated collection from an art history library embarks on a visual and intellectual odyssey, exploring an eclectic blend of European art from different periods and regions. Ranging from the German artists surrounding Ludwig I to modern reflections in Italian art, it dissects the quest for cultural identity, the nexus of artistry and literature, the fragile allure of glass, and the enigmatic relation between art and alchemy. It journeys through Italian museums, German galleries, Renaissance spirituality, and Hungarian art caches. Captivating catalogues of Italian paintings and sculpture, detailed digests of European drawings, and a suite of explorations regarding specific cities and monuments like Rome and Tivoli illustrate the intricate tapestry of Eurocentric art. Old masterworks breathe life beside contemporary sketches, hinting at the transformation of art over time. Biographies and portraits of pivotal figureheads adorn the collection, inviting readers to witness the continual shimmer of art in the crucible of time, mirroring modernity itself."
148,874.0645554202192,735.9220462850183,302,821," Panorama of European Art: Eras, Influences, and Cultural Dialogues"," This collection takes the reader on a grand journey through European art, ranging from Renaissance brilliance to the modern contours of Futurism. Titles such as 'La pittura eloquente' and 'Il Rinascimento nelle terre ticinesi' reflect the eloquent painting styles and the Renaissance's regional impact. 'Futurist skies' and 'La Scuola di piazza del Popolo' denote the avant-garde's break from tradition, while volumes like ""L'esperienza monastica benedettina e la Puglia"" showcase the intersection of religion and regional heritage. 'The decline of the Venetian nobility as a ruling class' and 'Rich and poor in Renaissance Venice' delve into the societal fabric behind the art. From the Byzantine era in 'Actes du XIIe CongrÃ¨s international d'Ã©tudes byzantines' to the nuances of power in 'Kunst und Macht', this array transcends boundaries, offering a tapestry of how art narrates history, culture, and power dynamics across time and space."
