cluster,x,y,nr_users,nr_books,cluster_title,cluster_description
0,147.90361445783134,657.0361445783133,5,83," Valencia through the Ages: Art, Architecture, and Historical Memory in the Crown of Aragon"," This collection chronicles the rich tapestry of Valencia's cultural heritage, from its medieval roots in the Crown of Aragon to its modern-day architectural triumphs. The books delve into the recovery of forgotten memories ('La memoria recobrada'), the inception of classical paintings ('El nacimiento de una pintura'), and the quest for mythical treasures ('A la búsqueda del Toisón de oro'). Readers can explore the symbiosis of Flemish and Valencian primitive painting ('La clave flamenca en los primitivos valencianos'), the heraldic traditions ('Heràldica catalana'), and the milestone works of Santiago Calatrava. These volumes examine Valencia's historical urban landscape and monuments ('Historia de la ciudad', 'Monumentos de la comunidad Valenciana'), its maritime significance in the 15th century ('Valence, port méditerranéen'), and its baroque emblematics and symbology ('Emblemática y cultura simbólica en la Valencia barroca'). The collection is an essential compendium for understanding the interplay between Valencia's art, architecture, and its role within the broader context of Spanish and Mediterranean history."
1,253.49242424242425,160.6590909090909,22,132," Journeys Through Time and Vision: Exploration, Cartography, and Perception in Art and History"," Spanning continents and centuries, this curated collection encompasses an intricate mosaic of travelogues, art history, and cartographic treasures. From the personal diaries of adventurers documenting their sojourns into the heart of Russia and the Caucasus to critical overviews of travelers in Russia before 1700, the cluster invites readers on an intellectual odyssey. Intertwined with these accounts are reflections on the nature of vision and representation, exploring subjects like the philosophy of sight, blindness in literature, and the depiction of ideal landscapes. It also includes immersive studies on specific regions, enhancing understanding with historical atlases and cartographic masterpieces, anchoring the reader in the rich geography of human adventure. This selection is a tribute to the insatiable human thirst for knowledge, spanning the analytical to the aesthetic, charting the evolution of human thought as much as the lands we've traversed."
2,442.8060135790495,882.5868089233753,324,1031, Cultures and Artistic Expressions: From Antiquity to the Renaissance," This selection of art history books offers a comprehensive journey through diverse epochs and regions, examining the hidden traces of the artistic past ('El trazo oculto') and the bygone grandeur of cultures such as Catalonia ('Cathalonia') and the reign of Emperor Augustus ('Die Bildnisse des Augustus'). It delves into ancient sculpting practices ('Polyklet'), lavish ecclesiastical designs ('Ornamenta ecclesiae'), and the interplay of power, arts, and warfare in history ('Il potere, le arti, la guerra'). Through 'Immagini per il Grand Tour,' readers travel back to the era of European exploration, while 'Jerusalem 1000-1400' highlights a pivotal historical nexus. The treasury of Saint-Denis ('Le trésor de Saint-Denis') and Italian primitive painters ('Primitifs italiens du Musée Jacquemart-André') showcase the richness of medieval art, which alongside other scholarly works on the Papacy, Renaissance Italy, and early Christian art forms ('Papsttum und Heilige', ""L'Italia di Julius von Schlosser"", 'Frühes Christentum zwischen Rom und Konstantinopel') reveal the intricate tapestry of history and artistic expression. The cluster also features biographical elements with treatises on Carl Justi and tributes to art historians, reflecting on the evolution of art historical scholarship. Additionally, thematic texts like 'Musis et litteris' and 'Weibsbilder' consider the role of muses and women in art, while 'Fälschungen im Mittelalter' confronts the authenticity and forgery in medieval art. This curated compilation not only addresses ecclesiastical and secular themes across Europe but also invites a contemplation of cultural exchanges and the enduring legacy of art from ancient craftsmanship to Renaissance innovation."
3,636.2900763358779,150.31679389312978,88,262, Sacred Art and Society: A Tapestry of Spiritual Heritage and Influence," This cluster of art history books weaves a rich tapestry of religious and cultural narratives, focusing on the profound influence of sacred themes and figures on European art from the Renaissance to the Baroque era. Encompassing biographical accounts of saints like Carlo Borromeo and Catherine of Siena, analyses of devotional practices, and explorations of the ecclesiastical splendors from Lombardy to Flanders, the collection traces the interplay between art, power, and gender. It highlights masterworks from the Vatican, the emblematic shift heralded by Martin Luther's Reformation, and the enduring allure of Italian and Netherlandish paintings, revealing the multifaceted nature of spiritual devotion as captured by the artists of the time."
4,714.0863309352518,198.58992805755395,94,278," ""European Artistic Heritage: Master Drawings and the Art Market from Renaissance to Baroque"""," This book cluster focuses on the intricate tapestry of European artistry as seen through master drawings from the Renaissance to the Baroque period. It encompasses scholarly catalogues of Italian, German, French, and Dutch drawings spanning the 16th to 18th centuries, highlighting private and public collections like those of Carl Theodor and the Albertina. The cluster explores the evolution of the art market, the advent of scientific examination of art, and the cultural exchange within artistic circles. It provides a comprehensive view on how art was collected, documented, and appreciated, revealing the complex narratives behind the masterpieces of European art history."
5,140.4508670520231,548.971098265896,60,173," ""Reflections of Culture: Art, Medicine, and Myth in the Medieval Tapestry"""," This collection delves deep into the rich fabric of the medieval period, weaving together the threads of art, knowledge, and mythology. The titles range from examinations of influential houses like 'Die Medici' to the role of animals in art and culture as seen in 'Animalia' and 'Bestiaire médiéval.' Medical advancements and practices of the time are explored in 'I codici di medicina del periodo presalernitano,' revealing intersections of science and art. The mystical allure of creatures like the unicorn is represented in texts like 'The unicorn' and 'Les secrets de la licorne,' illustrating society's fascination with the fantastical. Architectural works, such as 'Il Camposanto di Pisa' and 'Der St. Galler Klosterplan,' manifest the era's religious and aesthetic values. Coverage of iconic epochs, like 'L'autunno del medioevo in Umbria,' offers a glimpse into regional artistic developments. Together, these works articulate a multifaceted portrayal of medieval life, reflecting on how art, science, myth, and society are inextricably linked in humanity's ongoing narrative."
6,122.27485380116958,461.6374269005848,50,171, Evolving Visions: The Impact of Italian Art and Cultural Dynamics from Futurism to Primitivism," This curated collection from an art history library delves into the transformative periods of Italian and European art movements, primarily focusing on the emergence and development of Futurism and its influences in the 20th century. The titles, including ""Il Futurismo attraverso la Toscana"" and ""Scoperte e massacri"", reveal a scholarly examination of Futurist expressions within regional contexts and its avant-garde pioneers such as Marinetti. The cluster also explores the Italian perspective on Primitivism through ""Primitivismo"" and ""Primitivismes"", the historical contemplation of African art's impact on Italian museums, and the correlation between Italian cultural identity and its colonial past as evidenced by ""Gli italiani in Africa"". Additional works examine the broader implications of artistic movements like Expressionism, the role of artists in shaping societal narratives, and how Italy’s engagement with the modern, the primitive, and the historical has continuously influenced both visual art and cultural consciousness."
7,216.81159420289856,373.84057971014494,10,69, Reflections of Italian and Latin American Modernity: Art Across Continents and Eras," This curated collection delves into the rich tapestry of 20th-century art, focusing on Italian modernism and its interplay with South American artistic movements. The titles, ranging from ""Scuola romana"" to ""Tripoli 1933 - A. XI,"" and ""Novecento sudamericano"" to ""América Latina y la cultura artística italiana,"" reflect a juxtaposition of regional expressions of modernity, political influences, and the exchange between the Old and New Worlds. From the influence of antiquity in ""Mostra Avgvstea della Romanità"" to the dialogue with contemporary culture in ""The future of nostalgia"" and ""Cultural anthropophagy,"" the collection explores the spectrum of art's response to modernity including the Fascist era's impact on Italian art, as well as the cultural contributions of individual artists like Fausto Pirandello and Marino Marini. This cluster encapsulates the transformative power of art, political narratives, cultural exchange, and the legacy of Art Deco and modernist architecture, as seen in ""Architecture in Asmara,"" against the backdrop of growing global interconnectedness in the 20th century."
8,549.7250996015936,164.25896414342628,68,251," Chronicles of Art, Architecture, and Urban Evolution"," This collection of books from an art history library paints a detailed picture of art and architecture's interplay with history and urban development. Ranging from biographies like ""Padre Matteo Ricci"" to specialized texts on trompe l'oeil and Renaissance engineering, each title offers insight into the cultural and technical advancements that have shaped European cities and their structures. The cluster explores themes such as the ceremonial magnificence of the Vatican, the deceptive art of illusion, the vernacular architecture of Venice, and the detailed urban planning of cities like Naples and Rieti. Additionally, it includes treatises on hydraulics and fortifications, illustrating the technological innovations intertwined with the aesthetics of the time. This curated selection reflects a multifaceted study of urban transformation through art, architecture, and historical narrative, revealing the layers of human ingenuity in shaping the built environment."
9,102.2871287128713,363.6039603960396,18,101," Intersections of Art, Ruins, and Memory: An Exploration through European Eyes"," This collection bears witness to the kaleidoscopic nature of European art and its intellectual underpinnings as seen through the lenses of history, philosophy, and film. Anchored by Aby Warburg's iconographic scholarship in ""Aby Warburg, antropologo dell'immagine,"" the cluster traverses realms of aesthetic theory (""L'estetica e le arti""), the potency of ruins and the passage of time (""La forza delle rovine"", ""Vedere il tempo""), and the artistic interpretations of space, from actual (""La Cappella degli Scrovegni di Giotto"") to cinematic (""Cinema italiano""). It reflects on the very act of seeing (""Luce,"" ""The moving eye"") and creation (""La macchina della pittura""). The synergy among art history, film studies, and digital landscapes (""Archeologia del web"") imbues the collection with a dynamic exploration of cultural narratives, beckoning readers to witness how European art, in its many manifestations, grapples with the eternal questions of human existence, decay, and legacy."
10,401.2857142857143,110.5204081632653,85,588, Exploring Italian Art and Travel: A Journey through History and Culture," This curated collection from an art history library encapsulates the grandeur and depth of Italian art, cultural heritage, and historical landscapes. The titles range from ""Il Trionfo Delle Bell'Arti"" showcasing the triumphs of fine arts to in-depth catalogs of local artists like ""Catalogo Degli Artisti Bassanesi Viventi"". With detailed descriptions of famous galleries, such as ""Descrizione ragionata della Galleria Doria"", and treatises on cities teeming with art - like Venice in ""Il Ritratto Di Venezia"" - the collection paints a vivid picture of Italy's artistic pulse. Further enriched by historical accounts from ""Memorie Storiche Delle Chiese Di Verona"" and explorations like ""English travellers and Italian brigands"", this ensemble is a portal into the very soul of Italy for scholars and enthusiasts alike, illustrating not just the static canvas but also the dynamic story of Italy's evolution in art and society from antiquity to the modern era."
11,178.00833333333333,412.6666666666667,18,120, Milan & The Cinematic Metropolis: Architectural Evolution on Screen and Streets," This book cluster weaves a vivid tapestry of Milan's architectural grandeur, modern evolution, and its intimate relationship with cinema. Both a historical journey and an aesthetic exploration, the collection encapsulates the transformation from classical edifices to contemporary high-rises—a tale of 'Milano, il grattacielo e la metropoli.' It dives into urban narratives through 'Il cinema racconta Milano,' reflecting how film mediums shape our perception of urban spaces. This anthology, spanning theoretical 'Urban cinematics' to observational 'L' urbanistica di Milano,' is a comprehensive discourse on the interplay between Milan's urban development, public spaces, and gender dynamics within the built environment."
12,136.95081967213116,401.9508196721312,3,61," Audible Illusions: The Intersection of Cinema, Power, and Cultural Identity"," This distinctive cluster of books reveals a rich tapestry of studies focused on the intersection of cinema, cultural identity, and the resonances of power. Encompassing titles like 'Il porno espanso,' 'The cinema of David Lynch,' and 'Nazi propaganda films,' the collection traverses expansive terrains, from the avant-garde to the fascistic, probing how film reflects societal machinations. Works such as 'Il paesaggio nel cinema italiano' and 'Neorealismo' highlight the Italian perspective, juxtaposing regional artistry against global themes of voice ('For more than one voice'), space ('Cinema, gender, and everyday space'), and resistance ('In enemy hands'). Evocative of power dynamics from the erotic to the authoritarian ('Storia della cultura fascista'), this cluster invites readers on an auditory journey exploring the pervasive influence of sound and silence in shaping the human experience through film."
13,239.74603174603172,324.968253968254,4,63," Creative Intertwining: Art, Industry, and Innovation"," This curated selection of texts, 'Creative Intertwining: Art, Industry, and Innovation,' examines the dynamic relationship between art and industrial innovation, showcasing the transformative power of creativity within urban landscapes, manufacturing, and corporate culture. Titles like 'Gesti di rivolta' and 'Art and anarchy' explore the disruptive capacity of artistic expression, while 'I fotografi & l'industria' and 'Arte industriale' delve into the symbiotic narrative of photography, sculpture, and the manufacturing milieu. Works on corporate art collections, such as ""Renault - l'art de la collection,"" reveal the intersection of commerce and aesthetics. Contributions from Calder, Smith, and Perriand highlight the individual genius that has influenced modern design, merging art with functionality. 'Cities and creativity from the Renaissance to the present' and 'La lunga vita del design in Italia' provide historical context, tracing the evolution of creativity as a driving force behind societal and technological progress. This cluster unfolds a multifaceted discussion on the essence and impact of art in shaping the human experience in a mechanized world."
14,266.24444444444447,244.42222222222225,10,135, Journeys of Mind and Paper: Cross-cultural Encounters in the Arts and Humanities.," This collection bridges the aesthetic and intellectual wanderings across European landscapes, especially Italy and Germany, exploring themes of travel, art, culture, and the intrinsic relationship between libraries and knowledge dissemination. Within its pages, Goethe’s influence is a recurring motif, with several works examining his physical journey and philosophical quest during his Italian sojourn. The cluster also delves into cultural dialogues – from the Humboldt brothers' scientific pursuits to the impact of classical and Mediterranean dreams on German imagination. Amid historical correspondences and narratives, the cluster critically addresses the evolution and preservation of books and libraries, acknowledging their role in shaping and preserving historical memory, as seen in reflections on lost heritage like Palmyra. Intellectual exchanges are further discussed in the context of nationalism, postcolonial perspectives, and the digital era’s effect on printed materials. This assortment of texts celebrates the transformative power of travel, research, and reading, and the lasting impact of books as vessels of cultural transmission and discovery."
15,215.2133333333333,269.68,16,75," Narratives of Italian Art: Radicalism, Innovation, and Identity"," This bibliographic collection chronicles Italian art's evolution from traditional expressions to avant-garde movements and its intersections with political ideologies. Including ""XLIV Mostra della Galleria di Roma"" and ""Underground italiana,"" the titles capture the spirit of Roman artists and the alternative scenes. Works like ""Il piombo e le rose"" and ""Avanguardia di massa"" echo the tension between beauty and revolution. Theoretical perspectives are presented in ""The visual world of French theory,"" while ""Neolithische Kindheit"" and ""Genius loci"" stress the ancestral and locational influences. ""Neofascismi"" and ""Fascist voices"" probe art's role in shaping and challenging authoritarian narratives. Further enriched by focused studies on figures such as Enrico Baj and Achille Perilli, the collection embodies the rich tapestry of Italian art's journey through periods of intense change, creativity, and resistance, encapsulating themes ranging from the intellectual to the sensual, the public to the profoundly personal."
16,188.593984962406,220.8421052631579,23,133," Intersections of Art, Architecture, and the Anthropocene: A Journey through Italian Modernity"," This collection offers a deep dive into the myriad ways in which art, architecture, and environmental consciousness shape and reflect Italian culture and modernity. Titles like ""Arte e cinema"" and ""Arte diagonale in Italia"" explore the country's rich artistic practices, while ""Architecture as art"" and ""Superstudio"" underscore the aesthetic and ideological integration of built spaces. The presence of ""The concept of the animal and modern theories of art"" and ""Ecocriticism and Italy"" highlights a growing concern for nature's role in human creativity, a sentiment echoed in discussions of the Anthropocene in ""Das Anthropozän"" and ""Politics of nature."" Art movements like minimalism, arte povera, and conceptual art are discussed in relation to Italian identity and history, evident in ""Minimalismo, arte povera, arte concettuale."" Biographical works on Gianfranco Baruchello and Ugo La Pietra delve into individual contributions to this cultural nexus. The cluster provokes reflection on how our relationship with the environment, urban living, and historical past is aesthetically and conceptually constructed, debated, and reimagined."
17,178.6,278.5076923076923,5,65, Italian Innovations in Art and Design: Plasticity and Beyond," This clustered library collection spotlights the transformative period in Italian art and design from post-World War II through the late 20th century, focusing on the inventive use of materials, such as plastic, and the evolution of contemporary artistic expression. The titles, ranging from ""In plastica"" to ""Arte povera,"" mark a pivotal shift in aesthetic sensibilities, reflecting Italy's reconstruction of identity through fashion, architecture, and art. Highlighted are influential designers like Kartell, fashion powerhouses such as Sorelle Fontana, and artists including Nanda Vigo, Tomaso Binga, and Alberto Burri. Together, these works capture a dynamic era where tradition met innovation, shaping the cultural narrative of modern Italy."
18,271.5656565656566,298.9191919191919,21,99, Enlightened Echoes: The Cultural Legacy of Antiquity in 17th-19th Century Europe," This curated collection transcends time, illuminating the profound influence of ancient civilizations on European art, culture, and society from the Enlightenment through the 19th century. It explores significant themes such as the rediscovery and excavation of Pompeii and Herculaneum, the Neapolitan intellectual milieu of the 18th century, and the cultural policies during the age of enlightenment. The cluster weaves narratives of archeological enthusiasm, court culture, diplomatic intrigue, and royal patronage. Each book, whether focusing on artisan craftsmanship, like 'Ceramiche', or the impact of individual figures such as 'Lady Hamilton', contributes a unique thread to the rich tapestry of Europe’s enduring fascination with its classical heritage. Works examining the power of portraiture, the evolution of courtly collections, and the pivotal role of female monarchs in the arts, like 'The body of the queen', underscore the societal shifts and the confluence of the ancient and the modern in shaping Western identity."
19,195.39361702127655,332.2872340425532,16,94, Evolving Perspectives: Critical Discourses in Contemporary Art," This cluster of books from an art history library embodies a comprehensive exploration into contemporary art theories, exhibitions, and critical practices. It examines the nexus of time, politics, and cultural production, with a strong focus on how historical consciousness and critical theory inform current artistic expression. The texts trace the impact of globalism on art worlds, delve into the intricacies of curatorial practices, analyze the engagements and critiques of modernity and postmodernity, and scrutinize power dynamics within the art ecosystem. Furthermore, it highlights the significant contributions of women artists and reflects on art's transformative role in shaping modernity. The collection also contemplates the meaning of imagery and textual narratives within art history, emphasizing the importance of active dialogue in understanding the continual redefinition of art's social and historical context."
20,147.3021582733813,291.72661870503595,27,139, Exploring Modernism and Beyond: An Art Historical Journey Through Collections and Movements," This cluster of books presents an introspective journey through modern and contemporary art, spotlighting influential collectors, movements, and individual artists. Spanning from classic modernism with 'Turner, Whistler, Monet' to the revolutionary 'Roma pop city 60-67', the collection delves into the eclectic nature of pop art, Arte Povera, and the postmodern era. It includes personal libraries such as 'La Collezione Sonnabend', highlighting patron Ileana Sonnabend's impact and her connection with Arte Povera, the artist-centric 'Giulio Paolini' and 'Mario Schifano', and the broader narratives encapsulated in 'Art in theory, 1815 - 1900'. This curated selection spans across Italian and international scenes, documenting the transition from art's classical engagement with beauty and form, as in 'Segno e colore', to its contemporary cultural interventions, like 'Art and sexual politics'. Together, these volumes celebrate art's pluralistic evolution, inviting readers to reflect on how artists and their work continually reconstruct our comprehension of the visual and cultural landscapes that define our world."
21,162.33333333333334,328.4259259259259,6,54," Defining Italian Artistry: Collectors, Movements, and Masters of the 20th Century"," This curated selection from an art history library encapsulates the vibrant threads of 20th-century Italian art, highlighting significant collectors, influential artistic movements, and masterful creators. It explores the cultural landscape shaped by great minds such as Libero de Libero, Fausto Pirandello, and the collectors whose patronage spurred an era of creativity. From the Roman School to modern realism, and from the globally acknowledged Tiziano to the revolutionary Corrado Cagli, this collection chronicles Italy's profound impact on the art world. It offers readers unique insights into museum curation practices, while showcasing the aesthetic evolution of Italian art through pivotal figures such as Modigliani and Guttuso, set against a backdrop of global and Venetian renaissance influences."
