cluster,x,y,nr_users,nr_books,cluster_title,cluster_description
170,634.0851735015773,684.4164037854889,155,317, Illuminations of Art and History: Reflections from Italian Renaissance to European Enlightenment," This curated collection takes the reader on a journey through pivotal moments in art history, exploring a tapestry of cultural narratives from the optimism of early 20th century Italy to the architectural marvels of the Renaissance. Encompassing scholarly research papers, art critiques, and sumptuous visual records, these books delve into the dynamics of neoclassicism, the sanctity woven into sacred art, and the transactional relationship between art and society. From Flemish primitives to urbanism in ancient Rome, and from the enlightenment's citizen class to the spiritual grounds of the Byzantine Empire, each title in this assemblage offers a window into the soul of societies past, portrayed through their artistry, architecture, and scholarly pursuits. As this collection is a dialogue of aesthetics and piety, power and peasantry, classicism and modern anxiety, it proffers an engrossing survey of humanity's illustrious and multifaceted history of art."
171,689.3508771929825,743.624060150376,180,399," Reflections of Artistry: A Tapestry of Time, Technique, and Territory"," Spanning medieval Armenian architecture to Flemish painting during the reign of Charles V, this book cluster is an intricate weave of art across time and cultures. It encompasses the delicate nuances of light in painting, the noble tradition of graphic biennales, and the careful curation of private collections from Italian nobility. The symbiotic relationship of art and science is also explored, and the transformative influence of Renaissance winds on architecture is examined. This collection reveals the evolution of personal and communal expression, from autobiographical portraits of female artists to the grandeur of Roman baths and the quiet sanctity of hermitic traditions. It is an exploration of humanity's persistent quest to capture beauty, meaning, and self-reflection through the canvas of history."
172,411.7931034482759,553.1896551724138,13,58, Illuminated Heritage: Manuscripts and Miniatures from Byzantine to Baroque," This curated collection reflects the enchantment of European artisanship from the 9th to the 19th centuries, focusing on the meticulous craft of illuminated manuscripts, liturgical texts, and miniature paintings. It contains studies on regional artistry like the ""Artisti teramani dell'Ottocento"" and traverses through Italian illuminations to Franciscan manuscripts. Works like ""Enluminures italiennes"" and ""Le miniature italiane del Kupferstichkabinett di Berlino"" showcase the Italian finesse, while ""The Lehman Collection"" speaks to the culture of collecting such artifacts. From sacred texts in ""La cattedrale tascabile"" to scholarly analyses in ""Studies in medieval painting,"" this selection embodies the intersection of religion, culture, and historical bibliophilism that shaped the identity of the European manuscript throughout the centuries."
173,408.780487804878,566.560975609756,6,41, Sanctity and Stone: Chronicles of Artistic Devotion in Christian Antiquity," This enlightening collection offers an expansive exploration of Christian art, architecture, and archaeology, tracing the rich tapestry of religious expression from the early church to the late medieval period. It includes studies in the creative endeavours of artists, the patronage of collectors, and the veneration of saints throughout Christendom. Tapping into topics like open-air painting, basilica transformations in Ravenna, and the iconography of saints across Europe, the cluster combines scholarly insights into archaeological discoveries and liturgical installations with an appreciation of regal portraiture and identity. Complemented by a myriad of lexicons on saintly worship, this cluster embodies a profound journey through the still-standing thresholds of sacred history, emphasizing the continuity of religious tradition in art and society."
174,529.7735849056604,548.0188679245283,22,53," ""Chronicles of Artistry: From Medieval Relics to the Dawn of Modernity"""," This impressive collection of books weaves a rich tapestry of European art history, tracing the aesthetic and intellectual evolution from medieval adornments to the nuances of 18th-century artistry. The cluster offers a deep dive into the multifaceted world of jewelry with ""Toward an art history of medieval rings,"" explores Italian heritage in ""Il tesoro del Duomo di Bergamo"" and celebrates scholarly endeavors such as ""La biblioteca di Francesco Maria II Della Rovere."" It recounts the splendor of religious and civic architecture while delving into biographies of renegade artists with works like ""Le vite del Vasari nell'edizione del MDL."" The collection not only reflects on the physical creations of the past—such as cathedrals, palaces, and frescoes—but also on the intellectual landscapes that sculpted European culture, encapsulating the narratives of artists, their travels, and the societies that nurtured their talents. From the sacred pages of ""Sacred history"" to the grandeur of ""Twilight of the Grand Tour,"" this curated selection is a homage to the enduring legacy of European art across ages and genres."
175,386.68,396.44,3,50, Enlightenment and Illusion: A Journey Through Artistic Mastery and Media Evolution," This cluster embodies a comprehensive exploration of art's transformation over centuries, from the luminous era of Titian to the candid realism of photography. Spanning masterful Renaissance and Baroque artworks, it showcases the cultural exchanges between Italy and Weimar, and the youthful vigor of burgeoning museums. It delves into Italian drawings, influential European courts, and the visionary creations in the Sistine Chapel. The cluster also critically examines the technology and philosophy of photography, its archival challenges, and the intricate relationship between image and text. A reflective catalog of art's perpetual dialogue between dreams and reality, form, and function."
176,393.5625,406.4583333333333,9,48," ""The Essence of Italian Art and Architecture: From Venetian Churches to Tiepolo’s Frescoes"""," This carefully curated collection spans the grandeur of Italian architectural innovation and the emotive depth of religious art, with a focus on Venice's majestic baroque churches and the prolific works of the Tiepolo dynasty. Titles like ""Architettura, lo stato dell'arte"" and ""The late baroque churches of Venice"" provide an architectural framework, while ""Ordini religiosi cattolici a Venezia"" and ""Chiesa dei Gesuati"" delve into Catholic religious orders and their artistic expressions in church settings. The cluster pays homage to art luminaries like Giorgione, Sebastiano Ricci, and Tintoretto, with multiple works concentrating on the life and frescoes of Giambattista Tiepolo, including ""Tiepolo e le Storie di Scipione"" and ""The religious paintings of Giambattista Tiepolo"". Complementary studies such as ""Old age in the Middle Ages and the Renaissance"" and ""A history of old age"" provide historical context to the periods covered. The library also touches on Sculpture, textiles, and the art of arms with books like ""Le armi bianche"" and ""Das illustrierte Gewebe-Lexikon"", offering a comprehensive overview of cultural artifacts beyond paintings and buildings."
177,373.12280701754383,472.87719298245617,14,57, From Antiquity to Renaissance: Explorations in Historical Art and Space," This cluster presents a rich tapestry of art historical studies, weaving together themes from classical antiquity, the Middle Ages, and the Renaissance with a focus on Italian artistry. Titles explore diverse subjects, such as Roman art ('Römische Kunst'), medieval illuminated manuscripts ('Le Terme Puteolane e Salerno nei codici miniati di Pietro da Eboli'), frescoes of the Trecento ('Il Trecento riminese in Sant'Agostino a Rimini'), and the works of prominent artists like Paolo Uccello and Piero della Francesca. The interplay between art and architecture is examined through the lens of thermal baths ('Commentario intorno alle terme di Montecatini'), religious spaces ('La Cappella Portinari in Sant'Eustorgio a Milano'), and the broader cultural landscape ('Il parco visconteo nella letteratura'). The collection also contextualizes art within its societal and technological milieu, discussing spatial theory ('Texte zur Theorie des Raums'), genealogy ('Genealogy of the pagan Gods'), and art's relation to piety and perspective ('Painterly perspective and piety'). This selection forms a multidimensional portrait of historical art, as expressive of the societal values, technological advancements, and spatial dynamics of its time."
178,388.1860465116279,470.1627906976744,9,43, Reflections on Artistic Epochs: Renaissance to Baroque," This curated selection from an art history library captures a critical exploration of the transformative periods spanning from the Renaissance to the Baroque. Delving into questions of rebirth and reception, it challenges the reader to consider ""Was war Renaissance?"" while juxtaposing the psychological dimensions of architecture in ""Prolegomena zu einer Psychologie der Architektur."" It traces stylistic developments across Europe, analyzing pluralism and politics in art, and scrutinizes time as a shaping factor. Subjects range from ""Orient und Okzident"" in artistic perspective to Cézanne's revolutionary canvases. This cluster is an intellectual tapestry of aesthetic discourse, offering profound insights into style, culture, and historical progressions."
179,428.6,378.2545454545455,11,55, *Exploring Art and Architecture: Italian and European Cultural Heritage*," Delve into a rich tapestry of European culture through ""Exploring Art and Architecture: Italian and European Cultural Heritage,"" a curated collection whose titles reveal a profound exploration of Italy's artistic and architectural splendor. From the detailed catalogs of museum collections in Italian cities like Palermo, Verona, and Vicenza, to extensive descriptions of Naples, Venice, and Bologna, every book is a gateway to the Renaissance era's grandeur. Alongside are travel diaries, such as Johann Georg Keyssler's accounts, merging art with the very act of journeying through diverse landscapes. Essays on individuals like Vasari, Filarete, and Alberti complement city-centric works, providing insight into the minds that shaped the built environment. This literary mosaic not only illustrates the local artistic achievements but also offers comparative perspectives with discussions on English and German influences, thus painting a comprehensive picture of how art and architecture have been perceived, described, and transmitted across Europe."
180,380.45238095238096,427.45238095238096,6,42," Codices, Cartography, and the Craft of Knowledge in the Medieval and Renaissance Eras"," This collection traverses the intellectual and artistic landscapes of the Middle Ages and the Renaissance, reflecting the multifaceted relationship between pictorial representation, scholarly pursuit, and the progression of societal knowledge. It delves into the role of women in literary cultures, the artistry behind ancient map-making, and the innovations within early modern Europe. With an emphasis on manuscript illumination and the interlinking of art with science, particularly within Italian universities, the selection provides insight into the evolution of medical theories, the craft of memory, and the philosophical inquiries of the era. This cluster not only catalogues visual perception and optical studies but also explores the narratives and iconographies depicted in the precious texts, as well as the symbiosis of space, place, and perception. The convergence of artists and scholars in creating volumes of understanding illustrates the broad academic schema that underpinned a transforming worldview, revealing a tapestry of intellectual heritage woven with threads of artistic brilliance and scholarly rigor."
181,370.3953488372093,418.5581395348837,6,43," Cartographic Visions: Bridging Worlds in Art, Science, and Imagination"," This collection delves into the historical nexus where art, geography, and cosmology converge. From medieval representations of the cosmos to Renaissance exploration and the artistry of mapmaking, it spans disciplines and eras. Featuring seminal works on space perception such as ""Spatial Turn"" and ""Umwelten,"" the cluster emphasizes the role of visuality in shaping our understanding of the world. It examines technical advancements in ""Making medieval manuscripts"" and ""A Renaissance globemaker's toolbox,"" alongside thematic marvels in ""Sea monsters on medieval and Renaissance maps."" This cluster is an ode to the human quest to chart the unknown, manifesting global encounters through atlas pages and cartographic artistry. It reflects the enduring fascination with the interplay of the Earth and skies, and the portrayal of this relationship through the lenses of different cultures, as documented in ""Islamic maps."" It also bridges the story of artistry and exploration, amalgamating perspectives of artists who keenly observed landscapes such as Malta, expanding the narrative to encompass a worldwide tableau stitched together by cartographers and scholars across ages."
182,379.5490196078432,446.078431372549,8,51," Reflections of Humanist Thought in Art, History, and Discourse"," This curated collection from an art history library encapsulates a wide-ranging exploration of humanist ideals, the contemplation of nature, linguistic studies, and the dialogue between past and present in Western art and culture. From the Greco-Roman influence on Renaissance thought in ""Gli antichi e i moderni"" to the philosophical depths of Alberti's work, these books traverse the intellectual landscape of European history. Highlights include treatises on aesthetics like ""Gray is the color,"" works on art conservation, and studies on figures like Jan Van Eyck. The cluster culminates with interdisciplinary discussions of art, philosophy, and society, offering a multifaceted understanding of cultural evolution from antiquity to the Enlightenment."
183,406.29545454545456,538.4545454545455,13,44, Echoes of Sacred Spaces: From Antiquity to the Baroque," This collection of texts delves into the history of religious artistry, architecture, and archeology from ancient times through the Baroque period, with a focus on the Mediterranean and European regions. Highlighting buildings of worship like the Vatican chapels, the Hagia Sophia, and the Cathedral of Lucca, it tunnels through cryptic catacombs, illustrious Italian piazzas, and the ambit of the Byzantine world. It explores significant religious figures, liturgical instruments, and the interplay between art and ecclesiastical power. As readers move through the cluster, they encounter pilgrimages, church construction, and icons that have shaped the devotional visual landscape, offering a window into how the sacred realm was crafted and perceived throughout history."
184,551.4821428571429,544.0357142857143,13,56, Illuminations of Culture: Artistic Heritage from Byzantine Beauty to Renaissance Realities," This fascinating cluster of books from an art history library captures the essence of Europe's rich and diverse culture, spanning centuries and ranging from Byzantine masterpieces to the Renaissance's human-centric portrayal. It includes critical examinations of ecclesiastical architecture, sacred art, and the evolution of fresco painting in Italy. The cluster unveils the intimate diaries and correspondence that provide insights into the lives of nobility and artists, documenting the social fabric and intellectual exchanges that shaped Europe's cultural landscape. With a focus on the aesthetics of religious martyrdom, the sanctity of saints, and the secular celebrations in arts, this collection also explores the intersection of photography with painting and the meticulous documentation of early churches in the Alps. Further, it delves into the patrons of the art world, such as ecclesiastical figures and the Venetian elite, who influenced creative expression in textiles and metal crafts. By incorporating studies on influential artists like Mario Sironi and their contributions to the visual language of their times, it traces the lineage of creativity. The inclusion of graffiti on medieval churches, the majestic sculptures of the Napoleonic era, and the innovation of sacred pageantry illustrate the deep interconnectivity of art, history, and society. This title and description celebrate the scholarly investigation into the continuum of art history, revealing the layers of humanity's visual narratives."
185,452.3970588235294,374.05882352941177,12,68, Visions of European Art and Heritage: An Art History Library's Timeless Collection," This collection encapsulates the rich tapestry of European art, history, and cultural patrimony, ranging from specific exhibitions like 'April 21 - May 25 1955' to extensive catalogs such as 'Cataloghi del Museo Campana'. Titles like 'Delle lodi delle belle arti' and 'Raffaello Sanzio' represent the reverence for fine arts through the ages, while travelogues like ""Viaggio del Rever. P. F. Noe Bianco"" and multiple volumes of ""Lettres écrites de Suisse, d'Italie, de Sicile et de Malthe"" offer a glimpse into the Grand Tour era of educational journeys. Historically grounded books like 'Das Fresko der Thebais im Camposanto zu Pisa' pair with spiritual accounts in ""Memorie istoriche della chiesa e convento di S. Maria in Araceli di Roma"", anchoring the divine in art. Together, these works form a curated compendium reflecting the interplay of art, religion, and history in shaping European identity and the art world's narrative."
186,555.3658536585366,503.7317073170732,9,41, Cultural Confluences in European Art and Architecture," This array of books sheds light on the cross-pollination of cultural, architectural, and artistic practices within Europe, emphasizing Italy's pivotal role. From ""Meraviglie dalle Marche"" revealing the wonders of Marche to “Aby Warburg e la cultura italiana,” which delves into Warburg's study of Italian culture, the collection underlines Italy's influence. Works like ""Studies in Italian Renaissance architecture"" and “La corona del principe” explore the country's architectural heritage. The cluster extends beyond Italy, with ""Russi in Italia"" and “L' Est Europeo e l'Italia” discussing the interaction between Italy and Eastern Europe. It includes contemplations on artistic relationships like “Bernard Salomon illustrateur lyonnais,” intellectual discourse such as Machiavelli's impact on political thought, and the sacred in ""Prayer and power in Byzantine and Papal imagery.” Additional books like ""Tabula Peutingeriana"" and ""Das Musterbuch des Giovannino de Grassi” examine historical documents and craftmanship, illustrating the exchange of artistic techniques. Together, these works narrate a multifaceted history of artistic exchange, intellectual endeavors, and the societal and political landscape in European art and its surroundings."
187,567.5555555555555,507.5,9,36, Cultural Tapestry: Art and History in Italian and European Contexts," This curated collection encompasses a rich mosaic of European art history, with an emphasis on Italian artistic heritage, reflecting periods from the Biedermeier era to the Renaissance. Works like 'Il tesoro di Lorenzo il Magnifico' and 'Barocco in Italia' explore Italy's cultural pinnacle, while 'Women and men in early modern Venice' offers a gendered perspective on societal roles. Religious art is represented through 'A missal for a king' and 'Il tesoro della Cattedrale di Troia', while 'San Girolamo degli Schiavoni in Roma' touches on ecclesiastical narratives. The cluster includes scholarly treatises on specific artists such as the Induno brothers and Guercino, catalogs of collections like the 'Neue Pinakothek', and studies on sculpture and printmaking. With references to regional art like 'Rinascimento in Sardegna', and broader themes such as the role of art in media with 'Caravaggio in film and literature', this selection paints a vivid picture of how art, history, and society interweave to form the European cultural identity."
188,490.9322033898305,366.542372881356,10,59, Reflections on Art History: Cultural Narratives and Institutional Dialogues," This curated selection from an art history library encapsulates a rich tapestry of scholarly discourse on the evolution of art and its institutions. Spanning cultural analysis, personal recollections, and formal proceedings, the books explore the trajectory of art as both cultural history and individual expression. From Alois Riegl's theoretical contributions to the transformation and imitation in art, these texts investigate how art evolves and is understood. Official reports from international congresses reveal the academic exchanges shaping the discipline, while accounts of art collections and travels through Italy offer intimate perspectives on the artistic heritage. Essays on patronage and art politics during periods such as the Aufklärung (Age of Enlightenment) and the 19th century showcase the intricate relationship between art and power. The inclusion of tomes on Nazi art appropriation emphasizes the dark interplay of art and politics. The cluster culminates in reflections on methodologies, the role of Marxian thought in art history, and the dynamic functioning of art academies, framing art history as a field of perpetual inquiry, debate, and narrative construction."
189,471.1046511627907,366.5813953488372,10,86," European Artistic Heritage: Architecture, Sculpture, and Paintings from the Renaissance to the 19th Century"," This curated collection of books from an art history library spans the rich tapestry of European art, with a focus on architecture, sculpture, and paintings from the Renaissance period through to the 19th century. Titles such as ""Weltgeschichten der Architektur"" and ""Storia dell'architettura nel Veneto"" explore the evolution of architectural styles, while ""Il compianto sul cristo morto"" delves into the emotional depths of sculptural art. The cluster offers insights into the works of old masters, captured in ""Old master drawings including the Castle Howard Michelangelo,"" and showcases regional art phenomena like ""I Macchiaioli"" and ""La terraglia napoletana."" The assemblage includes geographical focuses on Venice in ""Reflections on Renaissance Venice"" and the art of specific landmarks such as ""Il tempio della consolazione a Todi."" Complementing these are explorations of artists' works and scientific investigations of art, like ""Le opere di Galileo Galilei"" and ""Traktat von der Malerei,"" highlighting the intersection of art, culture, science, and history across Europe."
190,548.1860465116279,410.30232558139534,12,43," Navigating Worlds: The Intersection of Art, Science, and Epistemology"," ""Navigating Worlds: The Intersection of Art, Science, and Epistemology"" explores the rich dialogue between the aesthetic realm and scientific discovery, examining how visual representation shapes our understanding of the cosmos and its earthly reflections. This curated collection delves into the historical influence of astronomy on art, the epistemological role of images in conveying knowledge, and the performative nature of iconology within cultural and scientific contexts. From the philosophies of aesthetics to the symbolisms of emblemata, and the scrutiny of Galileo's astronomical legacy, each volume offers a unique perspective on the visual as a potent device for conceptualizing, mapping, and interpreting both universal and human-centered environments. Through diagrams, maps, and pictorial imagery, this assemblage underscores humanity's perpetual urge to order and narrate the heavens, revealing the deeply intertwined nature of visual cultures, scientific methodologies, and the art of making the invisible intelligible."
191,401.94,516.92,10,50, Artistic Legacies of Sicily and Southern Italy: A Journey through Time and Culture," This collection represents a deep exploration of Southern Italian and Sicilian art, culture, and history, examining the interplay of local and religious identity through various forms of expression. It spans from antiquity to the early modern period, focusing on Messina's artistic heritage, the veneration of saints like Santa Rosalia, the evolution of print culture, and the influence of the Baroque movement. The titles in the cluster inform a narrative of regional development, showcasing museums, churches, and civic structures as repositories of memory and reflecting the rich tapestry of Mediterranean artistic and intellectual life. This multidisciplinary library cluster transcends mere art history, offering insights into devotion, architecture, collecting practices, and the pivotal role of Sicilian cities in shaping Western art's trajectory."
