cluster,x,y,nr_users,nr_books,cluster_title,cluster_description
64,470.2959183673469,244.1530612244898,30,98, Masterpieces of Art: A Journey Through Old Masters' Drawings and European Sculpture," This curated collection from an art history library encompasses a rich tapestry of European artistic heritage, focusing predominantly on Italian Renaissance drawings, Old Master sketches, and classical sculptures. Revealing the meticulous artistry of the Frührenaissance through 'Italienische Zeichnungen' and 'Genoese drawings,' it traces the lineage of European art. Collections like Mr. C. R. Rudolf's showcase the convergence of skill and patronage. Sculptural works represented in 'Italienische Skulpturen' and 'Antikensammlung' highlight the continuity of classical influences. The cluster offers not only a visual feast but also an intellectual odyssey exploring the realms of ancient Rome, Byzantine artistry, and Renaissance geniuses, all bound by the timelessness of their creations."
65,451.9102564102564,269.02564102564105,60,156," Impressions and Visions: Art, Architecture, and Photography in Italy and Beyond"," This curated collection from an art history library invites readers on a visual and academic journey through Italy's rich cultural tapestry. Spanning from early photography like 'Venezia nelle fotografie dell'Ottocento' to classical studies such as 'Vorbild Antike', the cluster blends the immediacy of images with the depth of scholarly research. 'Roma in stereoscopia' and 'Luce su Venezia' delve into stereoscopic and illumination studies of Italian cities, while 'Festschrift Eberhard Hempel zum 70. Geburtstag' and 'Einblicke, Einsichten, Aussichten' celebrate scholarly contributions to art history. From the 'Sculptures des jardins du Louvre' to Sicilian studies in 'Geschichte Siziliens', this cluster reflects on the influence of Italian ideals in Europe and explores the intersections of art, architecture, and the evolution of photographic documentation."
66,686.4,283.325,24,40, Immersive Journey Through Artistic Mastery and Cultural Heritage," This collection is an odyssey into the depths of artistic mastery, exploring a spectrum of eras, mediums, and cultural contexts. It weaves through the precise techniques of ""The draughtsman's art"" and dissects Michelangelo's period in Rome, while unraveling the essence of sacred art and architecture in ""Arte e architettura sacra."" Anatomical foundations in ""Anatomie für Künstler"" serve as critical footholds in the quest for realism. Lingual tapestries unfurl in etymological studies, reflecting the intertwined evolution of language and culture. Encyclopedias encapsulate the broad spectrum of human knowledge from Italy's formidable artistic traditions to the scientific and literary corpus. From the enigmatic allure of Elizabeth Barrett Browning's poetry to the architectural splendors in ""I quattro libri dell'architettura,"" each volume offers a distinctive vista into the human narrative expressed through art. Essays on newer movements and biographical accounts of illustrious lives like those of Goethe culminate in a treasure trove for scholars and art aficionados alike, inviting a contemplative journey through history's creative and intellectual chronicles."
67,513.7451923076923,224.1153846153846,73,208, Reflections of Italian Art & Architecture from the Grand Tour to Modernity," This collection encompasses a rich tapestry of artistic expression, architectural brilliance, and cultural evolution in Italy from the eighteenth to the twentieth century. It reflects on the allure of Italy as a destination for American artists and the enduring fascination with Rome's countryside and ancient roadways such as the Via Appia. With studies of individuals like Thomas Ashby, Harry Graf Kessler, and Edwin Lutyens, the cluster unveils the influence of Italian art on foreign artists and architects. It also explores the role of nature in creativity, German romantic interpretations of Italian vistas, and significant architectural developments in funerary design, royal palaces, and municipal planning. The titles suggest a continuous dialogue between Italian heritage and the wider world through scholarship, travelogues, and the legacies of cultural icons like Handel and the Scarlatti family in Rome. This reflective anthology invites readers to traverse historical landscapes, examine architectural drawings, and delve into personal memoirs that capture the essence of Italy as both a sanctuary for artists and an inexhaustible source of inspiration."
68,413.10526315789474,289.1578947368421,15,76," ""Fortresses and Flourishing Arts: The Military and Cultural Renaissance in Italy and Beyond"""," This cluster embodies the interplay between military engineering and cultural efflorescence during the Renaissance, with a focus on Italy and its European context. Spanning from the might of Venice's societal fabric to the iconic Castello Sforzesco in Milan, it illuminates the robust fortifications and strategic edifices pivotal in this era's conflicts. The assortment further explores the aesthetic charm of Italian gardens, the detailed accounts of cathedral constructions, and the nuanced beauty of courtly architecture. The collection candidly presents the era’s military endeavors through mercenaries, key campaigns, and illustrious figures like Francesco de' Marchi, paralleled by the growth in arts reflected in manuscripts, coins, and sacred architectural marvels. It's a testament to the Renaissance's multifaceted legacy, where the shield of war coexisted with the flourish of the arts within cityscapes, plazas, and beyond, laying bare the era's complex and interwoven tales of resilience, patronage, and sublime human achievement."
69,643.2757793764988,478.67865707434055,202,417," Reflections of Heritage: Art, History, and Culture Across Europe"," This curated collection within an art history library encompasses a rich tapestry of European art, culture, and historical discourse spanning several centuries. The cluster offers insights into specific artistic movements in Italy and Germany, glimpses into the lives of influential dynasties such as the Medici, and the impact of artistic heritage in geographical regions from Naples to Vienna. Integrating sacred art proceedings, archival documents, and explorations of medieval landscapes, the collection represents a dialogue between artworks, historical figures, and the evolving interpretation of antiquity. The scope of the collection stretches from expert examinations of individual artists and collections to broader themes of cross-cultural exchange, societal transformation, and the intimate relationship between the visual arts and historical consciousness. It serves as an invaluable resource for scholars and enthusiasts seeking an intricate understanding of European artistic heritage and its enduring influence."
70,624.7268722466961,388.77092511013217,93,227," ""Eclectic Panorama: A Journey through Art History"""," This cluster represents a rich tapestry of art historical study, spanning from medieval wood sculptures in ""Mostra di sculture lignee medioevali"" to the avant-garde expressions of ""Manifesti futuristi e scritti teorici di Arnaldo Ginna e Bruno Corra"". The collection delves into the works of the old masters, as seen in ""Seventeenth-century Dutch and Flemish painting"" and the Spanish genius in ""Velázquez, Rubens y van Dyck"". It embraces Italian contributions, from the Renaissance cityscapes in ""Venezia nel Cinquecento"" to the Tuscan plein air painters ""I Macchiaioli"". Notable collections like those at Leipzig's museum and themes in religious art such as ""The Chapel of the Ascension"" and ""Engel"" reflect the diversity of the genre. The cluster also highlights the interplay between art and society, as explored in ""Memorie e lettere"", and the impact of photography with multiple works on Man Ray. Altogether, the books encapsulate an eclectic panorama of art's evolution, its cultural intersections, and the enduring legacy of historical and contemporary masters."
71,703.9415887850467,390.4369158878505,187,428, A Tapestry of Italian Artistry: Cultural Reflections Across Time," This curated selection of titles embodies the rich tapestry of Italian art history, embracing a fusion of ages, movements, and expressions. From the futurist dynamism captured in ""Italian futurism 1909 - 1944"" to the sacred resonance in ""Arte sacra contemporanea,"" the cluster traverses through the corridors of time, where ""Il Risorgimento a colori"" revives the nation's vibrant past. A deep dive into performance is offered in ""Il gran teatro del mondo,"" while ""Corpo, automi, robot"" explores the intersection of humanity and technology. Scholarly pursuits in ""Meyer Schapiro e i metodi della storia dell'arte"" parallel regional explorations such as ""Argenti di Calabria."" The collection is crowned by critical exhibitions like ""Mostra internazionale d'arte 'Il presente contestato',"" indicative of Italy's ceaseless dialogue with modernity and tradition. Each volume is a portal, inviting an examining gaze into the multi-layered narrative of Italian creativity, from the sculpted allegories in ""Old master sculpture & works of art"" to the sacred slopes in ""Il Monte Soratte e i suoi santuari."""
72,581.8142857142857,307.37857142857143,68,140, Expanses of Influence: Art and Culture of the Italian and Iberian Peninsulas from Renaissance to Baroque," This book cluster navigates the rich tapestry of art history with an emphasis on the cultural and artistic expressions of the Italian and Iberian Renaissance and Baroque periods. Covering the grandeur of Lombardy under Spanish rule, Madrid's painting scene between 1650-1700, and the triumphs in Bacchanalian art, the collection delves into the methodological study of art history and the traditions of Western art. It encompasses a range of media, including drawings, sculpture, and music, highlighting masterpieces from Venice, Umbria, Milan, and Siena, and extends to discussions of Raphael, Arcimboldo, and the presence of artists like Sofonisba Anguissola in Spain. This curated selection reflects on the interface of art with politics, power, and the senses, offering a panoramic view that ties the regional artistic heritage to a broader European context."
73,367.8333333333333,631.3541666666666,43,144," Splendors of the Staufer Dynasty: Art, Architecture, and Power in Medieval Italy and Germany"," Covering the influential era of the Staufer (also known as Hohenstaufen) dynasty in medieval history, this curated collection explores themes of political ambition, cultural exchange, and artistic flourishing between the 12th and 13th centuries. Showcased through an array of titles focused on Frederick II, crusades, and Norman-Swabian influences in southern Italy, the cluster delves into the interplay between the Holy Roman Empire and the Kingdom of Sicily. It highlights the contributions to art, architecture, and governance with studies ranging from palatine chapels and Italian Gothic art to ecclesiastical structures and the unique Mediterranean blend of Norman, Arab, and Byzantine legacies. This selection also investigates the legacies left behind in legal codices, city foundations, and the spread of the Germanic culture, presenting a tapestry of works that reflect the rich aesthetic and socio-political fabric of an age defined by great monarchs, religious fervor, and the inescapable pull of the Crusades."
74,373.7663551401869,669.373831775701,36,107," Exploring the Medieval Tapestry: Architecture, Monasticism, and Culture"," This cluster of books offers a comprehensive journey through medieval European history, focusing on monastic life, feudal architecture, and cultural transitions. It encompasses the serene existence within early monasteries, as depicted in ""Benedikt und die Welt der frühen Klöster,"" the opulence of late medieval nobility through ""Adelige Sachkultur des Spätmittelalters,"" and the spread of Byzantine settlements in Calabria. The collection delves into personal narratives from ""Briefe seiner Reise nach Italien, Malta und Ägypten,"" portrays the aesthetics of medieval gardens, and explores the intricate relationship between text and image in hunting manuscripts. Drawing upon regional studies such as ""Monaci d'Occidente"" and ""Fernand de Dartein e l'architettura romanica comasca,"" it paints a picture of the broader European artistic developments, from cloister design to castle construction. ""Burg und Schloß"" and ""Burgenkunde"" provide insight into the fortifications that dotted the landscape. The spiritual symbolism within art is examined in ""Der Feigenbaum in der religiösen Kunst des Abendlandes,"" while tomes like ""The I. B. Tauris history of monasticism"" offer a scholarly perspective on religious life from antiquity to the middle ages. Through this assemblage, readers uncover the interplay of nature, architecture, and spirituality that defines the medieval era."
75,283.0326086956522,461.39130434782606,30,92," ""Reflections of Culture and Heritage: From Italian Dreamscapes to Northern Enlightenment"""," This curated collection encompasses a rich journey through European art history, spotlighting Italy and the Low Countries. ""Reflections of Culture and Heritage"" brings together an assorted array of works including historical accounts like 'Droom van Italie' and 'Rome au XIXe siècle', depictions of urban narratives through 'Tales of the city' and 'Portraits of the city', and peeks into private collections such as 'The collection of the late Dr. Hans Wetzlar'. It stretches to the profound reforms in the Church to the unique visions of photographers and printmakers. Insightful evaluations of artists like Pieter Saenredam sit alongside studies of guild records and the transformation of media over time, from panoramic views to the advent of photography. The cluster not only offers a glimpse into the ruins and revivals of Italian and Constantinopolitan past but also showcases northern renaissance marvels and the evolution of artistic techniques. It's a homage to the European testament of visual culture, encapsulating dreams, ruins, cityscapes, historical reforms, and the progress of art handling and preservation."
76,667.5398009950248,427.5298507462687,176,402," Reflections on Art, History, and Culture: An Interdisciplinary Journey Through Time"," Capturing the essence of human creativity, ""Reflections on Art, History, and Culture"" is an amalgam of literary gems charting the interplay between society and artistic expression. Spanning from pre-Renaissance to 20th-century modernism, this collection delves into classical motifs (""L' idea del classico""), explores sublime itineraries (""Itinerari sublimi""), and ponders over canine representations in art (""Cani da museo""). It incorporates scientific influences on art, as seen in 'Darwin,' and architectural photography's nexus (""Photographie et architecture""). With texts on medalists of Mantegna’s era, the haunting presence of specters in folklore (""Gespenster, Magie und Zauber""), and the Renaissance's opulent medals, the cluster reveals the rich tapestry of historical and mythological narratives. Manuscripts and ancient archives serve as cultural artifacts, demonstrating art preservation and showcasing auctioned collections. The spectrum is comprehensive, from European sculpture to illuminated manuscripts, underpinning art’s diversity and its continuous impact on shaping identity and legacy throughout the annals of history."
77,562.7865168539325,264.60674157303373,26,89, Treasures of Italian Art: From Renaissance Influence to Baroque Curiosities," This collection of works from an art history library unravels the rich tapestry of Italian artistic and cultural heritage, spanning the illustrious Renaissance, through the splendors of the Baroque era, to the intellectual vigor of the Mediterranean's urban centers. It examines Florence as an erstwhile hub of creativity, moving through Tuscany's bibliographic contributions, delving into the archives of prominent families — such as the Salviatis — and exploring the grandeur of Roman artistry. Insightful catalogs of art collections mingle with studies of pivotal figures like Machiavelli, Julius II, and Botticelli. The series traverses phenomena from the ecclesiastical to the governmental, highlighting contributions by lesser-known artists alongside masters like Raphael and Bramante. This curated selection paints a comprehensive picture of the evolution of art in the socio-political landscape of Italy, commemorating the sovereign spirit of its artists and the eternal allure of its iconic cities."
78,270.22222222222223,591.5757575757576,13,99, Epochs Intertwined: The Art and Architecture of Early Christianity and Antiquity," This cluster of books from an art history library presents a comprehensive exploration of the artistic and architectural evolution from late antiquity through the rise of Christianity within the Roman Empire and Byzantium. The titles range from studies of significant cities such as 'Eternal Ravenna' and 'The stones of Athens', to examinations of majestic structures like 'The Parthenon' and 'Diocletian's palace, Split'. Works such as 'Christianity and the rhetoric of empire' and 'The end of ancient Christianity' delve into the intersection of religion and politics, while 'Ambrose of Milan' and 'The life of Porphyry, Bishop of Gaza' offer biographical insights into prominent religious figures. 'The idea and ideal of the town between late antiquity and the early Middle Ages' reflects on urban planning principles, demonstrating how society's values are molded and mirrored in its physical spaces. Overall, the collection charts the transformative period when ancient pagan worlds and emerging Christian thought merged, substantially influencing the cultural and architectural landscape of the Mediterranean and European civilization."
79,542.7604166666666,612.3541666666666,28,96, A Tapestry of Art History: Diversity in Cultural Legacy," This collection spans the rich tapestry of Western art and cultural history, capturing pivotal moments from medieval Persia to Renaissance Italy and beyond. It includes ""La danza delle Avanguardie,"" highlighting modern art movements, and delves into the classical roots with ""Winckelmann."" The cluster explores Italian masters like Giotto and Baroque marvels in ""L' etï¿½ barocca dei Grimaldi di Monaco,"" while ""The Traditio legis"" and ""The Sibyl series"" trace religious iconography. From the individual ""European sculpture and works of art"" to collections like those of Achillito Chiesa, it investigates personal and institutional curation. With volumes on castle restoration in Southern Italy, the prophetic Sibyls' symbolism, and the revolutionary art theories of Wassily Kandinsky, this assortment interweaves architectural, pictorial, and sculptural discourse. The presence of Arabic and Islamic influences in Campania illustrates cultural intersections. Manuscript studies in Paris juxtapose against scientific advancements in ""Secrets and knowledge."" Each title, whether spotlighting local heritage or broader trends, contributes to the understanding that art history is a global and interconnected narrative, blending religious motifs, secular themes, and scholarly reflections on the ever-evolving artistry of humankind."
80,560.1319444444445,648.6666666666666,75,144, Epochs and Elegance: Artistic Expressions from Byzantium to Modernity," This collection spans the evolution of artistic expression from early Christian art to contemporary masterpieces. It unfurls the rich tapestry of European art history, delving into Byzantine and Venetian relations, exploring the majestic cityscapes of Naples and the ecclesiastical order in Siena. The cluster holds whispered secrets of iconography in manuscripts, frescoes, and drawings of old masters, offering glimpses into the intellect of Winckelmann and the societal influences on art, such as motherhood in St. Catherine of Alexandria's portrayal. Celebrate the nuanced interplay of art and power, tradition, and innovation in ""Epochs and Elegance: Artistic Expressions from Byzantium to Modernity."""
81,340.5882352941176,609.9852941176471,11,68," Echoes of Byzantium: Art, Devotion, and Scholasticism in Medieval Europe"," This curated cluster embodies the rich tapestry of medieval European art history, drawing profound connections across Byzantine influence, monastic scholasticism, and sacred art. The titles range from explorations of iconography and ideology (""Bisanzio e l'ideologia delle immagini"") to the artistic and cultural narratives of places like Calabria and Monza. Insight into regional expressions of devotion is offered through works on San Vincenzo al Volturno, saints' relics, and Marian imagery. Scholarly treatises on architecture, iconoclasm, and natural history reflect the era's intellectual pursuits. Furthermore, in-depth studies of the Longobards and seminal religious figures attest to the intertwining of art, faith, and identity. This collection is a testament to the enduring legacy of Byzantine artistry and its influence on the ecclesiastical and spiritual life throughout medieval Europe."
82,301.6981132075472,609.4811320754717,21,106, Echoes of Ravenna: Exploring Religious Art and Architecture from Antiquity to the Middle Ages," This collection delves into the rich tapestry of religious art, architecture, and ecclesiastical history, with a pronounced focus on the city of Ravenna and its Byzantine heritage. Within these volumes, scholars trace the historical narratives of sacred spaces, from the early Christian catacombs to the soaring basilicas, examining how architecture served both liturgical functions and symbolized ecclesiastical power. Works like ""Hagia Sophia"" and ""The cult of the saints"" explore wider themes of devotion and iconography, while specific studies on Ravenna's mosaics, inscriptions, and reutilization of ancient structures offer a deep dive into the ways religious art encapsulates theological, cultural, and societal shifts across Europe during the transformative Medieval epoch. This library cluster is a gateway to understanding the symbiotic relationship between the divine and the material in the formation of European sacred art heritage."
83,300.453125,590.234375,11,64, Reflections of Divinity: Art and Identity in the Roman and Byzantine Eras," This curated collection traverses the visual and cultural landscapes of the Roman and Byzantine periods, exploring themes of beauty, power, and piety. Titles such as ""Defining Beauty"" and ""Lebenswelten"" delve into aesthetic principles, while ""Life and death in Pompeii and Herculaneum"" offers a vivid glimpse into ancient daily life. Religiously transformative works like ""Transition to Christianity"" and ""Christian responses to Roman art and architecture"" underscore the profound shifts in iconography and ideology. The cluster also examines imperial iconography, from ""Sol Invictus Imperator"" to ""Constantine, divine emperor of the Christian Golden Age,"" revealing the interplay between leadership and the divine. Books on urban representation, such as ""The urban image of late antique Constantinople,"" architectural analysis, including ""Principles of Roman architecture,"" and artistic mediums like mosaics and textiles, with titles like ""Mosaics of the Greek and Roman world"" and ""Late Byzantine liturgical vestments,"" underscore the multifaceted nature of art in expressing identity, power structures, and religious narratives across centuries."
84,441.3921568627451,311.45098039215685,31,102, The Journey Through Art and Identity: An Exploration of European Heritage," This cluster of books in an art history library unveils a thematic narrative about the evolution of European art, architecture, and self-representation. It encompasses discussions on aesthetics like ""Was ist schön?"" and self-presentation in ""L'arte di presentarsi,"" while delving into the opulent Baroque period with titles like ""Mostra del Barocco Piemontese."" It offers a comprehensive study of Hadrian's legacy through ""Villa Adriana - una storia mai finita,"" and showcases the collections from the Museo Gregoriano Egizio. These works traverse through the grandeur of Italian, French, and English 18th-century life, exemplified in explorations of the Villa Adriana, Parisian society, and the works of architects like John Soane and Inigo Jones. The ensemble challenges the reader to consider the intersection of art, culture, and identity as seen through various lenses, including aristocratic patronage, travel literature, and the philosophies of noted thinkers like Goethe and Winckelmann, thus laying out a mosaic of European high culture and its ongoing dialogue with antiquity."
