,id,lang,title,year,embedding_x,embedding_y,cluster
640095,BV038509310,ger,Zur Rekonstruktion des Görzer Grabes in der Linzer Stadtpfarrkirche,1973,-356,-91,7
986832,BV044876933,ita,I sette peccati capitali,[2018],233,547,8
741681,BV038667590,fre,Quelques mots sur le livre d'heures chartrain du Musée national de Stockholm,1952,178,-469,-1
47884,BV012608132,eng,Journal of mathematical biology,1974-,-219,39,16
1013214,BV046055572,eng,Social media activism,[2019],-521,-534,5
816656,BV038854771,ita,Testo e immagine nell'editoria del Settecento,2008,-342,-651,-1
111954,BV036696134,ita,Gli archivi fotografici delle soprintendenze,2010,-713,169,-1
5333,BV001251487,ger,Bildhandbuch der Kunstsammlungen in der DDR,1985,-205,-312,18
1119812,BV047757208,fre,La faïence de Rouen au XVIIe siècle,1869,301,404,8
952085,BV043648769,ger,Metasuche in Wasserzeichendatenbanken (Bernstein-Projekt),2016,13,730,-1
388458,BV038158310,eng,Plaster casts of Bernini's bust of Charles I,1996,82,534,-1
1172070,BV047947830,ger,Über die Seelenruhe oder Vom Vermeiden des Leidens in drei Büchern,[2022],-260,-130,7
699788,BV038602287,ita,Il polittico di Lorenzo Veneziano,1967,-27,-195,16
1043147,BV047067624,eng,Original forgiveness,2020,-452,130,-1
520198,BV038319570,eng,(Editorial),1974,233,130,-1
38380,BV009857882,ger,Karl der Grosse und die Wissenschaft,1993,370,286,-1
377406,BV038143450,dut,Een ijvore Mars van Francis,1999,-384,-456,-1
259378,BV037961801,ita,Il recupero ottocentesco degli smalti en ronde-bosse,2004,-178,-417,-1
25206,BV005207248,fre,Les apports néerlandais dans la peinture du sud-est de la France,1963,123,182,13
862054,BV039804237,ita,Recondite Armonie a Ronchamp,2010,-342,-156,7
865065,BV039962369,ita,"Disegno, rilievo, ri-disegno per il progetto di restauro",2010,-850,560,-1
233812,BV037923688,ita,"Perizie e disegni di Martino Longhi il Vecchio, Sebastiano Cipriani, Carlo Francesco Bizzacheri, Carlo Fontana per la Casa e Torre Secura nel rione Monti a Roma",2002,-96,-182,-1
1027664,BV046695843,ita,Atti del XXV colloquio dell'Associazione italiana per lo studio e la conservazione del mosaico,[2020],617,26,-1
539049,BV038348583,ita,Di Amico Aspertini,[1919?],68,443,8
619203,BV038477090,fre,"La Vierge allaitant l'Enfant sur le croissant de lune d'Alejo de Vahia, une sculpture castillane au musée du Louvre",1990,-233,365,-1
942145,BV043249574,ita,Firenze capitale della fotografia,2015,-603,-482,-1
950452,BV043581750,eng,Great expectations: prospects for the future of curatorial education,[2016],-1111,-1016,-1
403582,BV038179533,ita,Andreas Freitag e il tipografo A. F.,2001,-452,-521,-1
8828,BV021536941,eng,Painting the difference,2005,68,782,-1
386756,BV038156012,ita,Architettura di utilità pubblica e di magnificenza pubblica a Bologna nel secolo dei lumi,2000,-425,547,-1
291612,BV038013873,ita,Una interessante scoperta artistica a Beccacivetta di Coriano Veronese,1973,123,156,-1
596152,BV038441377,ger,Die Inschriften im Langhausgewölbe von Maria Saal,1983,493,169,-1
233005,BV037922426,ger,Deutsche und italienische Baukunst im Trecento,1996,-274,560,-1
722423,BV038637761,ger,Vierhundert Jahre Münchener Schatzkammer,1965,274,-91,-1
146758,BV037684838,ger,Caspar Scheuren,2010,-315,0,-1
50086,BV012917185,ger,Grenzenlos in die Zukunft,2000,-150,-104,17
645823,BV038518568,fre,Étude concernant la restauration de la Cour de Marbre du château de Versailles,1978,-672,365,-1
146352,BV037682930,ita,La via della ceramica tra Umbria e Marche,2010,-452,-625,-1
674827,BV038562431,eng,The Augustus John exhibition at Cambridge,1978,-438,456,-1
685930,BV038580946,ita,Le macchine imperfette,1980,905,1160,-1
661614,BV038542004,ger,Bernardo Bellotto in Dresden und Warsaw,1964,109,-169,10
848217,BV038944115,ger,Einführung in die Kunstsoziologie,1957,0,743,-1
268279,BV037975573,ger,"Prunk, Pracht, Peche",2005,82,65,11
42593,BV011217756,ger,Tradition und Innovation im Werk des Pierre-Etienne Monnot,1997,603,299,-1
974681,BV044429466,eng,Chivalry and romance in the Chronicle of Bindino da Travale,2008,-370,-730,-1
404750,BV038181510,ita,Avanzamenti nel consolidamento ad ago,2000,27,143,16
917583,BV042171921,eng,The moral psychology handbook,2010,27,-117,16
130047,BV037602022,ita,L' arte cristiana del Nuovo Mondo,1997,-96,-495,-1
86740,BV022279517,ita,Venezia 1806,2006,68,573,9
152625,BV037699396,ita,Renzo Ferrari,1981,96,521,-1
628986,BV038492340,dut,Een ets waarop een tweetal cellen van het klooster der Kartuizers van St. Andries bij Amsterdam is afgebeed,1953,-425,-365,5
349608,BV038103294,eng,The design of structural ironwork 1850 - 1890,1992,109,-39,11
1015882,BV046171406,ita,Roma-Milano,[2019],-96,-234,16
631207,BV038495951,ger,Das Alabaster-Madönnchen in der Sagrestia Minore von Sto. Stefano zu Venedig,1961,-301,-351,-1
984352,BV044758842,eng,The Venice variations,2018,192,378,-1
499915,BV038294663,fre,Du nouveau à propos des relations entre Jacques Callot et Filippo Napoletano,1993,301,821,-1
670285,BV038555080,ger,Hilfe bei der Hochwasserkatastrophe,1958,438,-195,-1
371466,BV038135977,ger,Dr. Grohmanns Empfehlungen,1999,-192,-925,1
1124710,BV047762165,fre,Expositions de la Royal Academy et de la Grosvenor Gallery,1882,-397,-260,5
824281,BV038877925,ita,Bruno Innocenti e l'immagine femminile,2000,384,117,3
442489,BV038231124,ita,L' impossibilità del giardino (ital. u. engl),1981,576,-117,-1
1115932,BV047753326,eng,Night effects in Indian pictures,1910,219,299,13
271629,BV037981673,spa,"Antonio Carnicero, 1748-1814",1997,-617,-156,-1
759466,BV038687684,dut,"[Rezension von:] Bruyn, Eric de: De vergeten beeldentaal van Jheronimus Bosch : de symboliek van de 'Hooiwagen'-triptiek ennde Rotterdams 'Marskramer'-tondo verklaard vanuit Middelnederlandse teksten. - 's-Hertogenbosch, 2001",2003,-466,-65,7
1120194,BV047757591,fre,"Andrea Mantegna, 3",1886,-41,-130,-1
407766,BV038186255,fre,Les premiers écrits sur l'art au Portugal (1541),2001,411,65,-1
443848,BV038232573,ita,"Gino Severini, l'unanimismo di Jules Romains e le danze cromatiche di Loïe Fuller",1990,534,234,-1
78755,BV021500384,ger,ANThology,2006,-288,-469,-1
75648,BV020317591,ger,Um 1800,1920,-233,-964,-1
717004,BV038629449,ita,Asterischi bresciani,1972,-823,586,-1
614267,BV038469466,dut,Een landschap met de Prediking van Johannes de Doper door Abraham Bloemaert,1953,315,391,8
175778,BV037755623,ger,Zur obersten der drei Tiaren auf Raffaels Disputa,1962,-507,260,-1
482173,BV038274122,eng,"A list of the publications of J. B. Trapp, with a selection of review",1990,-384,39,-1
636254,BV038503335,cze,Neznámá práce z dílny litoměřického mistra v moravských sbírkách,1961,-603,-65,-1
99285,BV035484822,ita,I vetri della Sicilia punica,2008,-178,0,-1
183157,BV037772599,ita,Il monumento al Papa Benedetto XV nella Patriarcale Basilica Vaticana,1928,-301,-143,7
320419,BV038060335,eng,Alexander Roslin,2008,-727,182,-1
1043733,BV047076114,ita,SS. Trinitas Scotorum e SS. Trinitas Scottorum,1938,-823,273,-1
88551,BV022510695,ita,Mario Botta,2007,-370,365,-1
987275,BV044886755,ita,La colomba e il caduceo,2017,288,286,13
1034886,BV046853507,fre,La Passion de sainte Christine de Tyr/Bolsena,2019,288,495,8
835384,BV038904229,eng,"Astrolabes and angels, epigrams and enigmas",2007,411,-873,0
987355,BV044888331,eng,Access to online resources,[2018],123,-312,10
76860,BV020872418,ita,Joe Colombo,2004,246,-117,-1
264390,BV037969367,eng,Making visible,2005,-631,-65,-1
1385,BV000379038,fre,L' art roman de l'ancien Anjou,1984,-411,430,-1
90630,BV023055584,ita,Le cento novelle contro la morte,2007,192,508,8
700636,BV038603864,ger,Mit den Augen des Malers,1969,-123,782,-1
386960,BV038156267,eng,Finis belli pax,1999,-384,-143,-1
265367,BV037971216,eng,Death by fire,2005,-631,39,-1
867412,BV040229752,ita,La nazione allo specchio,2012,-329,-664,-1
71988,BV019673929,ita,La pittura su maiolica a Faenza nel secondo Ottocento,2002,192,273,13
1115557,BV047752951,eng,Recent designs in domestic architecture,1907,-644,260,-1
199696,BV037812025,ita,"Scuola di Oreficeria Benvenuto Cellini, Valenza",1967,-329,-534,-1
864576,BV039947697,ita,"Lodovico Tommasi, la poesia dell'arte",2011,-27,-430,-1
243253,BV037938002,ger,Das malerische Werk,2004,-452,-26,7
236436,BV037927774,ger,Der Palazzo Magnani in Bologna als Zeugnis und Instrument sozialen Aufstiegs im Kirchenstaat,2003,-493,-1108,-1
153963,BV037703252,eng,Enzo Cucchi,1999,-260,469,-1
100465,BV035643334,ita,Una rondine non fa primavera,2008,-260,-391,18
826902,BV038885241,ita,Carrà oggi,1989,-987,-378,-1
948765,BV043537204,ita,Anticipazione di nuove considerazioni sulla Cappella Bardi di Vernio nella basilica di Santa Croce a Firenze,2016,288,417,-1
1121859,BV047759256,fre,"Le Musée de l'Ermitage à Saint-Pétersbourg et son nouveau catalogue, [2]",1864,82,1029,-1
850130,BV038948327,ita,Progettare per Messina,1997,164,143,-1
23339,BV004805180,ita,Leonardo,1991,233,-26,12
166088,BV037732017,ita,Luigi Bompard,1983,-178,-338,-1
508596,BV038304404,ita,Giovanni di Simone,1986,-534,104,14
595893,BV038440948,fre,Acquisitions,1980,-54,638,-1
4347,BV000960152,ger,Die Kunst der Augsburger Goldschmiede 1529 - 1868,1980,-68,-730,1
468398,BV038258995,ita,Posta Fibreno,1982,-68,-234,-1
835088,BV038903672,ger,Daniel Chodowiecki,1922,-13,651,9
334033,BV038080862,spa,"La limpieza de los Gladiadores en un banquete, de Giovanni Lanfranco, del Museo del Prado",2007,-123,104,6
525020,BV038327175,fre,Les fouilles de Saint-Victor de Marseille,1972,740,117,-1
101916,BV024254094,ita,Strutture dello spazio antropico,1976,-960,-430,-1
330969,BV038076144,ger,Glänzende Geschichte,2008,-109,-482,-1
898944,BV041487169,eng,Collecting modern Chinese art in the 1930s,2013,164,351,8
36243,BV008947261,eng,The Princes Gate collection,1981,384,-899,0
373800,BV038138791,ger,Die Renaissance der frühchristlichen Architektur in der Karolingerzeit,1999,-425,469,-1
718244,BV038631392,fre,Deux documents sur les Tuileries (1792 - 1793),1964,205,-208,-1
155118,BV037706802,ita,Le Paladine della fede,2000,-384,-482,18
989660,BV044934614,ger,Kundennutzen durch digitale Transformation,[2018],219,-169,-1
992939,BV045058818,eng,Dietary intake and behavior in children,2018,178,-26,-1
55977,BV013508538,eng,The Bible as book,2000,-370,-1277,-1
942461,BV043261713,ita,Regina Coeli,[2005],631,664,-1
1007488,BV045534341,ita,Paradoxa,2017,-480,-234,-1
179271,BV037764888,ita,Notizie storico-descrittive della Chiesa Cattedrale di Vicenza,1848,-356,716,-1
609278,BV038461689,ita,Quattro ritratti ritrovati di Alessandro Longhi e altri inediti,1971,562,521,2
141758,BV037665342,ita,3a Mostra Internazionale della Ceramica,1961,397,182,13
397100,BV038169479,ger,"Ort, Raum, Technik und Architektur",2000,1481,-221,-1
124024,BV037562610,ita,Luigi de Servi,2001,-96,234,-1
327276,BV038070515,ita,Nuove opere di Giuseppe Diziani in Istria,1997,164,299,8
748561,BV038676292,spa,A propósito de un proyecto de Antonio Ponz,1990,-534,365,-1
122999,BV037555563,fre,Les vitraux des musées de Strasbourg,1978,-329,-378,18
687796,BV038583998,fre,La peinture murale de l'église de Chaource,1955,0,612,9
643155,BV038514324,fre,Quelques nouveaux dessins de François Perrier,[1983?],-562,599,-1
744773,BV038672258,fre,Le plan de l'église de Trois-Fontaines,1964,150,26,11
1044201,BV047080446,ita,I libri miniati di Andrea Matteo III Acquaviva,2020,-411,-508,18
227133,BV037907286,ita,Antonio Corpora,1983,246,39,-1
496220,BV038290529,ita,Scultori per il presepe napoletano del Settecento,1982,877,-325,-1
555732,BV038373366,ger,Zum Fund eines Grenzsteines im Falschauerbett,1979,-631,-690,-1
69845,BV019336438,eng,The Charnley House,2004,-137,195,6
108181,BV036472184,eng,Biblical archaeology,1962,-301,534,-1
565513,BV038388729,ger,Loy Hering und Christoph Rodt in Elchingen,1950,246,-65,12
147852,BV037688832,eng,Mannerism and modernism,2011,631,-143,-1
361622,BV038122020,ger,Sic Romae,1996,-288,104,-1
26063,BV005276132,ger,Kunstgewerbe,1922,-164,91,-1
1125224,BV047762679,fre,"Hans Holbein sur la route d'Italie, 2",1898,109,821,-1
1064115,BV047373359,ita,Come nasce un libro,[2021],13,-260,16
207773,BV037830419,ita,Umberto Brunelleschi,1979,-644,365,-1
693211,BV038592861,eng,Buffington and the skyscraper,1935,-109,-195,16
711623,BV038620835,ger,Der Heilige Jacobus an Or San Michele in Florenz,1967,685,299,-1
597124,BV038443021,ger,Gestaltung des sozialistischen Menschenbildes und intelligenzintensive Kunst,1967,68,-469,-1
142789,BV037669431,ita,Scoperte nelle Marche intorno a De Magistris,2008,-96,312,-1
366986,BV038130505,ita,La chiesa di Santa Maria del Crocefisso e il convento dei Padri Cappuccini,2010,-397,-130,-1
693566,BV038593512,cze,Nové poznatky k stavebni historii Kroměřiže,1957,82,143,-1
235300,BV037925939,spa,"Las colecciones pictóricas del Real Monasterio de San Lorenzo del Escorial, vistas por los viajeros románticos",2001,-685,612,-1
557545,BV038376308,ger,Der Lettner der Klosterkirche zu Münstersteinach,[1971?],27,743,-1
941794,BV043222351,ita,Una prima analisi di alcuni nuclei della raccolte civiche fiorentine,2012,411,-716,0
634136,BV038500070,ita,Un' interpretazione del complesso paleocristiano di S. Giustina,1968,54,-378,-1
715602,BV038627414,ger,Das alternde Kunstwerk,1967,-150,-886,1
853977,BV038956743,ita,Giovanni Michelucci,1966,-534,625,-1
594201,BV038438352,fre,Joseph Beuys,1980,589,-156,-1
432005,BV038220179,fre,Serlio en France,1987,-534,-625,18
595178,BV038439935,dut,Russische prentkunst der 18e en 19e eeuw,1947,-452,-260,-1
671382,BV038556952,ger,Die Lünetten der stanza del tesoro im Palast des Lodovico il Moro zu Ferrara,1964,-466,-560,-1
123482,BV037559847,ger,Brandschutz in Baudenkmälern,1996,246,508,8
634170,BV038500173,ger,Neue Wege der Denkmalpflege in der Tschechoslowakei,1960,-164,821,-1
540535,BV038350604,ger,Über die Waffensammlung der Markgrafen und Grossherzöge von Baden,1975,-466,456,-1
940593,BV043048686,eng,From Rome to Lisbon,[2015],-617,-495,-1
248107,BV037944762,ger,Giovanni Segantinis Selbstbildnis von 1895,2004,534,547,2
1119497,BV047756893,ger,Gartenstadt Haslach in Freiburg,1995,109,-325,10
333227,BV038079634,ita,Il Monumento Forteguerri di Andrea del Verrocchio,1996,274,-39,-1
150077,BV037694422,ita,Percorsi della memoria,1998,274,221,13
325996,BV038068672,ita,Padova,2008,-54,-247,-1
742510,BV038668780,eng,Whistler and Sickert: a friendship and its end,1966,-397,208,-1
1036527,BV046903947,ger,Schweiz - Niederlande: Kunst im Austausch,[2020],548,-325,-1
870361,BV040304151,ita,L' arte del Trecento in Europa,2012,-96,-469,-1
316983,BV038054544,ita,Per i colli tuscolani alla ricerca della villa di Cicerone,1955,-137,-273,-1
637138,BV038505062,eng,Viking art in the Scandinavian countries,1969,-507,-391,-1
672020,BV038558087,cze,Doplňky ke středověkým stavebním dějinám farního chrámu sv. Mikuláše ve Velkém Meziříči,1973,54,-143,-1
546592,BV038359429,dut,Jan de Bisschop (1628 - 1671),1971,562,625,2
1174944,BV048247322,ita,Astratte,©2022,-631,-664,-1
734303,BV038656524,eng,The Life and works of William Hodges,[1978?],-466,65,-1
135709,BV037635569,ita,Percorrendo giardini di virtù,2005,-54,143,-1
741197,BV038666836,fre,"Albert Bouts, alias le Maître de l'Assomption de la Vierge",1977,-617,286,-1
980005,BV044642940,eng,We Are Always Turning Around on Purpose,2017,-150,0,17
592256,BV038434882,ger,"Daniel Heintz, Balthasar Irmi und der Spiesshof in Basel",1978,288,-417,-1
155693,BV037708473,ita,Libra,1991,-27,-743,1
348908,BV038102330,ita,A proposito di due campane della città conservate nei civici musei di storia ed arte,1977,246,-143,-1
340519,BV038090426,ita,La cristianizzazione della Dalmazia,2008,-658,-221,-1
918983,BV042179134,eng,"War, revolution and the bureaucratic state",1995,164,-325,-1
276368,BV037989213,ita,"Cappella Palatina, parte il restauro Würth",2005,370,417,-1
375740,BV038141173,ita,Perché ho scelto la Francia,1997,41,1016,-1
421696,BV038205149,ita,Cultura artistica a Matelica nella seconda metà del Quattrocento,2002,384,404,-1
156898,BV037710990,ita,Ilario Fioravanti,2009,480,547,2
569313,BV038395056,ger,Zeichnungen aus dem Leben,1987,82,560,9
281916,BV037998424,eng,Wordly creation in Rembrandt's Landscape with Three Trees,1994,-54,-430,-1
343871,BV038095111,ita,Arte alla corte di Francesco I,1998,-397,365,-1
259640,BV037962213,ger,Gebundenes Adelsvermögen,1995,-27,-795,1
1054758,BV047202962,ita,Gli horti dei Papi,febbraio 2021,-836,547,-1
262794,BV037967096,fre,L' hôtel de ville de Nancy,2005,288,234,12
425924,BV038211956,ita,Verso una pluralistica filosofia della conservazione per il XXI secolo,2002,-246,560,-1
308442,BV038040870,ita,Ettore Roesler Franz,2007,233,-312,-1
321285,BV038061768,ger,Laser wird zunehmend von Restauratoren genutzt,2008,-370,0,7
1023306,BV046421160,ita,Eventi miracolosi come strumenti di legittimazione o delegittimazione del potere nei primi Visconti di Milano,2019,603,430,-1
815431,BV038849633,ger,Die stadtrömischen Christen in den ersten beiden Jahrhunderten,1987,-219,-117,-1
391737,BV038162508,ger,Die Silberfigur der heiligen Katharina vom Artistenszepter der Wiener Universität,2000,-589,182,-1
152075,BV037698488,fre,Le temps dans la peinture,1994,-548,-351,-1
1012270,BV046030208,eng,"Paul Revere's Philip, King of Mount Hope, from Thomas Church's The entertaining history of King Philip's war",2013,54,795,-1
375331,BV038140713,ita,Il gres caldo,1996,13,208,16
483914,BV038276217,ita,"[Rezension von:] Valerio, Vladimiro: Atlanti napoletani del diciannovesimo secolo : (1806 - 1860). - Napoli : Regina, 1980 // Omodeo, Anna: Grafica napoletana del '600 : fabbricatori di immagini ; saggio sugli incisori, illustratori, stampatori e librai della Napoli del Seicento. - Napoli : Regina, 1981",1981,-82,221,-1
74685,BV020015901,ita,Romanico e Gotico,2005,-411,-117,7
682084,BV038574419,gre,Stereōsis kai apokatastasis tu exōnarthēkos tu katholiku tēs Monēs Daphniu,[1964?],-466,273,-1
326358,BV038069219,ita,Problemi di scultura in Friuli,1972,192,560,8
290977,BV038013030,ita,Un rivestimento in ceramica per la cupola di S. Maria del Glorioso a Sanseverino Marche,2006,123,208,13
309061,BV038041963,ita,Saluti ai convegnisti,2007,137,-39,11
585478,BV038422665,ger,Die Konsekrationsmünzen Kaiser Konstantins und ihre religionspolitische Bedeutung,1958,534,104,-1
423411,BV038207779,ita,Un' Athèna per Carlo d'Angiò,2002,-521,-482,5
609100,BV038461441,ita,Due documenti inediti sullo scultore Gian Maria Morlaiter,1978,-315,338,4
60358,BV014236598,ita,Vincenzio Borghini,2002,301,325,8
11642,BV001915555,eng,Art and architecture in Belgium,1960,-342,-312,-1
521984,BV038322196,fre,Les lunettes et la profession d'opticien d'après quelques comptes des XIVe et XVe siècles et les consequences cliniques qui peuvent en être déduites,1967,-54,456,15
322588,BV038063765,ger,Zur Gestaltungsmethode von Joos de Momper,1994,-288,-417,-1
645459,BV038517976,fre,Le portail de Saint Thibault (Côte-d'Or) dans ses rapports avec les principaux monuments de la sculpture bourguignonne du XIIIe siècle,1964,-329,743,-1
378015,BV038144124,ita,Salvo,1999,-466,-39,7
32566,BV007544142,eng,Icons and their dating,1974,-384,169,14
362719,BV038123699,ita,Alcune sculture medievali poco note di Varese,2010,562,391,-1
47823,BV012604058,eng,Archive for mathematical logic,1950-,-507,286,-1
1078856,BV047716239,ger,Vier lithographische Einzelblätter von Goya,1906,-452,417,-1
11656,BV001917054,ger,Die byzantinische Stadt im 6. Jahrhundert,1969,-150,-391,-1
401541,BV038176579,ger,Multireligiöse Räume,2000,41,677,-1
1044942,BV047092828,ita,Un progetto del 1907 per la prima parte di via dell'Impero,1977,-109,13,-1
173833,BV037749840,ger,Joseph Anton Koch,1939,-534,312,-1
515648,BV038313126,ger,"Notiz über Ankauf des Portraits der Madame Prangen durch das Staatl. Kunstmuseum, Kopenhagen",1954,137,-117,-1
3324,BV000811666,ger,Untersuchungen zu den Patria Konstantinupoleos,1988,-631,273,-1
672506,BV038558949,ger,Drei Fischer,1958,164,91,11
35249,BV008618870,ger,Lexikon der Weltarchitektur,1971,219,-273,-1
133125,BV037618832,ita,Animali e creature mostruose,2004,-713,-795,-1
986268,BV044863065,ita,Sardegna archeologica,gennaio 2018,301,1081,-1
268782,BV037976318,hrv,Djela Bartolomea Litterinija u Dalmaciji,2004,-27,91,16
603839,BV038453747,eng,In the wake of the Bury Bible,1979,589,338,-1
973364,BV044407470,eng,Language beyond words,[2017],-301,-430,18
517293,BV038315464,fre,Les Porcelaines de Jacob Petit,1952,-754,78,-1
1026991,BV046673094,eng,Rodin's sculpture in Japan and the economics of translocation,2018,-384,769,-1
920313,BV042227974,ger,Neuerfindung der Fotografie,2014,493,-91,-1
332934,BV038079113,ita,Ricorrendo al Bernini,1995,246,-221,-1
787524,BV038787248,eng,A critical and historical corpus of Florentine painting,1930,288,391,-1
1037132,BV046916375,ita,I funerali come strumento di indagine storica e culturale,2019,-713,-247,-1
311416,BV038045692,ita,Il palazzo dei Vescovi di Feltre,1966,-562,130,-1
960477,BV043888848,eng,Juvenal and Persius,2014,-631,378,-1
73394,BV019809824,ita,Sulle tracce di un passato minore,2004,-384,-325,-1
376684,BV038142500,ita,Nuovi brani pittorici,1997,150,365,-1
1030982,BV046772847,por,André Soares,2020,-137,-482,-1
250367,BV037948079,ger,Der gebändigte Babelturm,2004,68,-443,-1
526589,BV038329569,eng,George Stubbs,1986,-301,404,-1
585616,BV038422905,ger,Goethe und die Gotik,1926,-205,-417,-1
191522,BV037791122,ita,"Pittura, museo, città",1975,288,0,12
723595,BV038639621,fre,À propos de la chronique de Mouzon,1984,-164,-221,-1
833181,BV038900486,ita,Il catasto di Pisa del 1428-29,1964,-68,-182,16
826061,BV038883136,ita,Dal sincretismo romanico al verticalismo gotico,1999,-891,573,-1
349419,BV038102935,eng,Animals in the paintings of Titian,1998,-507,-834,-1
737143,BV038660665,ger,Die Michaeliskirche,1993,-342,-469,-1
664340,BV038545914,pol,In memoriam Frits Lugt,1971,68,677,9
21124,BV004077344,ita,Giuseppe Sciuti,1989,-288,782,-1
126472,BV037576348,ita,La grande Roma dei Tarquini,1990,-315,-130,7
114858,BV037246533,ita,Storia della Brianza,2010,905,-847,-1
211368,BV037839355,ger,Untersuchungen zur Geschichte der Architektur und Plastik des früheren Mittelalters,1916,82,-273,10
833650,BV038901130,ita,Roma nel pensiero e nell'arte di Ugo Foscolo,1972,-192,-847,1
354714,BV038111529,ita,La chiesa parrocchiale di Villafalletto,1976,-233,26,-1
64225,BV017091509,ger,Medien der Kommunikation im Mittelalter,2003,260,521,8
580812,BV038414896,pol,Rozwój naukowego aspektu działań konserwatorskich w dziejach Muzeum Narodowego w Warszawie,1987,384,325,-1
359192,BV038118592,ita,Postille alla mostra cosentina del 1976,1977,82,221,-1
906919,BV041740373,eng,Biggi New York,2013,0,404,9
11928,BV001932177,ger,Brügge und Ypern,1900,864,756,-1
295747,BV038020536,fre,La Bethsabée des 'Heures de Guyot Le Peley' et le traitement du thème dans l'oeuvre de Jean Colombe,2007,205,-443,-1
918681,BV042178830,eng,Jefferson Davis's generals,2000,-384,117,14
160185,BV037719430,fre,Delacroix,1994,-205,208,6
634367,BV038500616,eng,The Quango and the gentlemanly tradition,1982,-315,312,4
841030,BV038920913,ita,"Stazio nella tradizione classica, medioevale e rinascimentale",2002,425,78,13
915422,BV042109463,ita,Iconografia cateriniana,2013,-823,-1238,-1
152255,BV037698792,ita,In Toscana dopo Degas,1999,-123,208,9
559431,BV038379003,ger,Hans Jaenisch,1959,-246,534,15
375499,BV038140886,eng,"Veronese, Callet and the Black Boy at the Feast",1999,-315,860,-1
131821,BV037612334,ita,L' illustrissima città di Viterbo,2002,-384,-299,-1
764491,BV038694052,eng,Hogarthomania and print culture,1998,480,-312,-1
890518,BV041108663,ita,Antiquaria e falsi cartografici nella Sicilia del Seicento,2012,-521,-404,-1
614431,BV038469792,ger,X. Kongress des wissenschaftlichen Beirats des IBI,1971,-274,273,4
43584,BV011513504,ita,Alberto Magri,1996,329,-273,-1
706832,BV038613583,ger,Die Herstellung salzglasierten Steinzeugs im einer Töpferei in der Südeifel,1973,0,-847,1
1125706,BV047763161,fre,"Exposition de maîtres de l'École Lombarde à Londres, [2]",1898,0,351,9
347644,BV038100601,ita,La decorazione delle regge di Carlo e Ferdinando IV,2009,-123,286,9
951667,BV043633894,ita,In & around - ceramica e comunità,[2016],466,-690,0
419136,BV038201372,ita,Diamanti,2002,13,26,16
595115,BV038439839,eng,Report from Rome: Art and public buildings,1961,-617,234,-1
390092,BV038160531,ger,Drei bayerische Herzöge auf Glas,1996,27,-847,1
391929,BV038162720,fre,Saint-Vincent de Cardona et la dimension méditerranéenne du premier art roman,2000,150,104,-1
948137,BV043515488,ita,"Qual teatro, qual pompa, e quale incanto",[2015],-96,-208,16
396053,BV038168194,eng,Is there a future for the spiritual in art?,1998,-329,-195,7
1064748,BV047390728,ita,Il culto nazionale di Dante nell'Ottocento italiano,2021,342,-964,0
535557,BV038343232,fre,Les débuts de l'art roman en Dalmatie,1955,452,-234,-1
514108,BV038310850,eng,Two sculptures by Dalou,1953,13,677,-1
1042661,BV047056464,dut,Over de opgravingen in de Kerk San Sebastiano aan de Via Appia bij Rome,1924,96,-156,10
397623,BV038170288,eng,Scottish master masons of the Renaissance,1991,-342,521,-1
953880,BV043693352,ger,Winckelmann-Kritik als Ursprung einer Autonomie-Ästhetik,2015,41,443,8
160476,BV037720048,fre,Parallele de plans des plus belles salles de spectacles d'Italie et de France,[ca. 1775],-480,-573,-1
451282,BV038240556,ita,Contributo alla storia della pittura riminese tra '200 e '300,1992,68,365,9
1057186,BV047244247,fre,"Sans beauté ni éclat (Is 53, 2)",2018,-397,-286,5
178478,BV037762765,ger,Die gotische Kölner Plastik,1910,521,273,-1
865442,BV039977003,ita,Un sarcofago romano e una piramide nel monumento funebre di Domenico Petrucci a Viterbo,2011,-164,-65,17
1175098,BV048249683,fre,Pour l'histoire du christianisme à Aquilée et dans la région nord-adriatique,2020,-356,-117,7
233551,BV037923314,ita,Il pellegrinaggio al Perdono di Assisi e la tavola di prete Ilario da Viterbo,2002,13,-104,16
