,id,lang,title,year,embedding_x,embedding_y,cluster
541838,BV038352462,eng,Lucian Freud,1974,-521,91,14
144573,BV037676405,ita,Narcissus,1982,-836,-1251,-1
18029,BV003213162,ger,Frauen zur Goethezeit,1975,-658,586,-1
1069366,BV047513471,fre,Muret antiquaire,2020,260,-338,-1
347305,BV038100147,ita,Attività delle soprintendenze,1968,27,-13,16
957966,BV043824401,ita,Testimonianze storico-archeologiche nell'area mercuriense di Orsomarso,[2016],562,-365,-1
850566,BV038949227,ita,Alfabeto cristiano,1994,150,-52,11
702888,BV038607391,eng,The skyscraper,1959,123,234,13
2689,BV000687480,ger,Die sakrale Baukunst Italiens im 11. und 12. Jahrhundert,1987,-644,-625,-1
696397,BV038597424,eng,A Utrecht Book of Hours in the Royal Library at The Hague,1958,-589,-234,-1
982257,BV044699246,ger,Der Farbtondruck,[2018],-480,-52,-1
291025,BV038013105,ger,Die Glashütte Moser in Karlsbad,1998,-480,104,14
1033126,BV046819602,ita,Il sogno dell'immagine,[2019],-411,-534,18
713742,BV038624290,ger,Kupfer für die Kunst wiederentdeckt,1965,-342,651,-1
366911,BV038130405,ita,29 maggio 1453,2008,-576,-795,-1
310367,BV038043884,ger,Die Grand Tour - Spanien,2008,960,612,-1
1127592,BV047765047,ita,L' opera di Domenico Gagini in Sicilia,1903,-397,26,-1
408120,BV038186841,ita,Exemplar e manoscritti peciati nella Biblioteca Malatestiana di Cesena,1995,-617,-208,-1
155242,BV037707106,fre,De la physionomie humaine et animale,2000,397,156,13
1055260,BV047210766,ita,L'ultima spiaggia,2021,-562,-677,-1
160793,BV037720728,ger,Zur Entwicklungsgeschichte der barocken Deckenmalerei in Wien,1920,-356,378,-1
1130649,BV047768105,ita,Mostra di disegni del Baroccio agli Uffizi,1913,-82,560,9
321032,BV038061443,ger,Die Anschaulichkeit des Sozialen und die Utopie Film,2008,205,156,-1
1026399,BV046655929,eng,"Romanesque saints, shrines and pilgrimage",2020,-178,260,9
734661,BV038657021,und,"[Rezension von:] Thelen, Heinrich: Francesco Borromini : die Handzeichnungen ; I. Abteilung: Zeitraum von 1620/32 ; 2 vols. - Graz, 1967",1976,617,-104,-1
14843,BV002555959,fre,Etudes et travaux,1966-2010,219,-378,-1
343020,BV038093831,ita,Massimo D'Azeglio a Roma,1957,-233,-469,-1
936495,BV042759284,ita,Anchora inparo,2014,356,456,-1
321981,BV038062798,ita,"Museo, paesaggio culturale e identità collettiva",2006,-384,-65,7
865594,BV039985064,ita,Tre inediti documenti dell'Archivio del Monastero di S. Maria del Monte di Cesena,2012,219,586,8
388443,BV038158274,ita,Transiti in Russia,2000,-452,260,-1
542827,BV038353964,pol,O kilku portretach Jana Kazimierza,1977,603,612,2
963390,BV043991735,eng,Maurizio Galimberti,[2016],-219,560,15
625723,BV038487260,eng,Whistler - search for a European reputation,1978,-617,365,-1
43164,BV011384307,ger,Die Architektur im 20. Jahrhundert,1977,-425,495,-1
1011073,BV045915690,eng,Drawing education: worldwide!,29.05.2019,288,782,-1
685199,BV038579637,cze,Nástěnné malby v ambitu kláštera Na Slovanech,1966,-1399,-847,-1
676627,BV038565612,eng,East or West in 11th-century Pisan culture,1984,54,-195,-1
956902,BV043798303,ita,Una Schichtgravur dell'Ottocento,2015,-699,-312,-1
36631,BV009107666,ita,Gli scavi di Aquileia,1993,-864,-26,-1
412604,BV038192561,eng,Andrea Pozzo's Prospettiva de pittori e architetti,2002,-617,312,-1
581973,BV038416853,ger,Das Sinopienmuseum im Camposanto am Dom zu Pisa,1981,82,273,16
1074672,BV047669746,eng,"Velázquez, Titian and a lady with a fan",2021,137,-482,-1
491786,BV038284939,ita,"La tipografia nel secolo XV a Vicenza, Santorso e Torrebelvicino",1993,521,-169,-1
275267,BV037987611,ita,Negozio Olivetti,2006,13,286,16
904781,BV041645095,ita,Un'opera inedita di Gaetano Fabrizi,2013,781,130,-1
128833,BV037593558,ita,"Pietro Faccini, 1575/76 - 1602",1997,-480,130,14
816789,BV038855310,fre,La résurrection de Lazare dans les monuments funéraires des nécropoles chrétiennes à Rome,1993,137,-508,-1
791340,BV038795557,ita,"Il nuovo teatro delle fabriche, et edificii, in prospettiva di Roma moderna",1665,-41,677,-1
572320,BV038399927,ger,Kruzifixdarstellungen vom 9. bis 12. Jahrhundert,1981,-192,273,15
680128,BV038571505,fre,Quatre peintres polonais d'aujourd'hui,1960,27,351,9
656879,BV038534677,eng,A footnote on Goya and reality,1977,-384,430,-1
858858,BV039623053,ita,"Ezio Nesti, un grande ceramista dimenticato",2011,-727,-286,-1
40626,BV010606972,eng,Salvator Rosa,1995,-411,-143,-1
693206,BV038592853,ger,Ausgrabungen in der Altstadt von Magdeburg,1958,617,-156,-1
244959,BV037940384,ger,Stadtumbau Ost und Denkmalpflege in Leipzig,2004,-205,-860,1
552517,BV038368430,fre,Les arts mineurs de l'Orient musulman à partir du milieu du XIIe siècle,1968,-631,-247,-1
41761,BV010960295,ger,Der Absolutismus - ein Mythos?,1996,356,-143,3
93278,BV023344106,eng,Classical and romantic performing practice,2008,370,-104,3
956535,BV043790813,ita,Barletta e la Terrasanta,2015,0,-378,10
144028,BV037673971,eng,The Vatican and Saint Peter's Basilica of Rome,2009,-246,378,-1
172892,BV037747318,eng,"Memoirs of early Italian painters, and of the progress of painting in Italy, from Cimabue to Bassano",1859,260,52,3
624867,BV038486041,eng,Hans von Marées and the classical doctrine in the nineteenth century,1938,-727,495,-1
936836,BV042775888,eng,Representing beasts in early Medieval England and Scandinavia,2015,-699,260,-1
486848,BV038279382,ger,Ein Raphael aller Zeiten in Landschaften,1989,-178,338,15
39354,BV010173439,ger,Niederländische Zeichnungen des 17. und 18. Jahrhunderts,1993,68,-912,-1
1009156,BV045682579,ita,Considerazioni sui motivi della ridipintura del Crocifisso della Chiesa di San Frediano a Pisa,[2019],315,-286,-1
1044530,BV047085043,ita,Aquileia alla ribalta,2019,-123,-286,16
123197,BV037558013,ita,Codici virtuali,2000,-192,-13,-1
892479,BV041224453,eng,The Israeli response to Jewish extremism and violence,2002,219,-195,-1
148205,BV037689994,ita,"Figure, memorie, spazio",2011,-164,-247,-1
1001822,BV045338717,ita,Enrico Della Torre,[2018],-617,677,-1
105013,BV036062541,ita,Utilità e bellezza,2009,603,664,-1
295907,BV038020853,ger,Matérialisme de la reproduction vs. vision d'ensemble,2007,178,-312,-1
886134,BV040903499,ita,Narni e i suoi santi,2013,-1467,-677,-1
1122453,BV047759852,fre,"Le trésor de la cathédrale de Reims, [2]",1881,1165,0,-1
114841,BV037244303,eng,Trade in artists' materials,2010,288,677,-1
277399,BV037990735,ita,Gianluca Corona,2006,-27,560,9
961999,BV043955475,eng,On the evolution of steel-concrete composite construction,[2015],260,651,-1
907931,BV041773213,fre,Question d'honneur,2013,-438,273,-1
72962,BV019793646,eng,Book history online,1989-,-356,-1290,-1
564813,BV038387668,ita,Caravaggio e Caravaggeschi nelle Gallerie di Firenze,1970,137,-430,-1
321253,BV038061726,ita,Attività delle soprintendenze,1968,877,769,-1
188021,BV037783467,fre,P. Delvaux,1987,41,-130,-1
561198,BV038381832,eng,The Madonna delle Muneghette,1980,-13,26,16
1173992,BV048217679,ita,Clima negli edifici di culto,[2022],-631,-508,-1
54739,BV013393896,eng,Parkinsonism & related disorders,1995-,-68,782,-1
575297,BV038404958,eng,The Vision of St. Bernard,1974,521,91,13
1021118,BV046319167,fre,Expositio de Apocalypsi sancti Iohannis,2019,96,26,11
961816,BV043951523,ger,Vom Sinn und Nutzen der Diözesangeschichte,2016,-685,39,-1
153360,BV037701350,fre,Rogier de le Pasture-van der Weyden,1999,-589,-156,-1
79482,BV021585208,ger,Im Herzen der Mona Lisa,2006,-534,651,-1
274764,BV037986738,ger,Das Buch im Buch,2005,-370,-1303,-1
609667,BV038462415,ita,Il deperimento delle opere d'arte,1982,438,-769,0
839806,BV038917188,swe,Venetianska teckningar,1990,-466,-716,-1
346920,BV038099442,ger,Le Téméraire - der Tollkühne - ein bibliophiler Mäzen?,2010,-781,-1095,-1
50037,BV012901548,ita,Ninfa 1298,1998,-96,-834,1
40383,BV010546314,ita,Al di là della decadenza,1994,-877,-378,-1
149829,BV037694034,ita,Arrigo Minerbi e gli scultori della Fornace Grandi di Bondeno,1998,-603,221,-1
317766,BV038055883,eng,The poise of the head und die Anderen folgen,2007,41,-156,-1
568446,BV038393421,srp,Parohijska crkva Uspenja Bogorodice i neka hronološka i stilska pitanja renesanse na Pagu,1986,-411,508,-1
684290,BV038578119,cze,O funkcích uměni,1961,13,52,16
660267,BV038540222,und,Riflessioni sulla Pittura veneziana del Seicento di Rodolfo Pallucchini,1981,-96,182,6
1060119,BV047280319,ita,La veduta di Bratislava a Firenze,2020,-288,-443,18
398092,BV038170927,ita,"1618, 1634",1999,-233,0,-1
1077398,BV047714780,ger,"Die Fürstlich Lichtenstein'sche Galerie in Wien, [4]",1895,-82,404,9
535594,BV038343297,ita,Disegni napoletani nella Galleria Nazionale di Palermo,1977,-507,-495,5
715116,BV038626626,ger,Denkmäler der Verbindung von Herakles und Dionysos in Moesien und Thrakien,1953,534,78,-1
382324,BV038149514,ita,"La costruzione, i restauri, gli arredi della chiesa di San Francesco in Rocca attraverso i documenti d'archivio",1996,-68,104,16
265491,BV037971387,ita,Bassorilievi anglo sassoni ed irlandesi come modelli base per pannelli e mensole dell'Abbazia di S. Antimo (Siena),1992,-493,-1081,-1
288103,BV038008252,ita,L' Istruzione storico-pittorica di Giacomo Mancini (1832),2006,-397,-338,5
312006,BV038046484,ita,La pala d'altare dell'Oratorio di S. Sebastiano ed altri fatti della scuola di S. Marco in Prato,1980,-246,325,-1
45799,BV012215852,ita,Grammatica e retorica dei santi,1997,0,-769,1
204642,BV037821265,ita,Gli statuti comunali nella storia di Cuneo e del Cuneese,1992,-370,651,-1
907250,BV041748612,eng,Interior of the new Hermitage - coming back to their original view,2011,0,91,16
857356,BV039560999,ita,Il canto della terra,2011,288,-443,-1
671313,BV038556833,eng,"The workshop of a XVII century goldsmith, an unrecorded French print",1954,452,-26,-1
939568,BV042951107,ita,L'intervento di restauro eseguito sul dipinto di Luca Signorelli conservato a Castel Sant'Angelo in Roma,2014,329,378,-1
907958,BV041774562,fre,Un littoral sans nature ?,2014,-164,-195,-1
514394,BV038311275,fre,A. Dunoyer de Segonzac,1954,-356,-65,7
122759,BV037549051,eng,Carpets and rugs of Europe and America,1996,68,599,9
626553,BV038488448,srp,O radnom danu srednjovekovnog zografa,1966,123,443,8
550860,BV038365901,ita,"Opere poco note o ignorate di Giuseppe Torretti, Matteo Calderoni, Alessandro Tremignon",1976,-96,-365,-1
63533,BV016518562,ita,Il Palazzo dei Diavoli a Siena,2002,-109,456,15
821045,BV038867525,ger,Gemälde alter Meister,1984,-27,169,16
53727,BV013301362,eng,Journal of psycholinguistic research,1971-,-740,716,-1
616308,BV038472677,ger,Zwei Holzfestungen aus dem 17. Jahrhundert im Norden Russlands,1980,13,-286,16
603695,BV038453473,ita,I gradini di Providence,1981,-315,912,-1
784125,BV038775231,eng,Medieval and renaissance manuscripts in the Walters Art Gallery,1997,480,-78,-1
44064,BV011669312,ita,Principi e città alla fine del medioevo,1996,0,-716,1
202175,BV037817059,eng,"Catalogue of works by Dame Laura Knight, D. B. E., R. A. and Harold Knight, R. A.",1973,-493,273,-1
620412,BV038478965,fre,Une nouvelle technique de vitrail,1964,-466,-325,5
1126716,BV047764171,fre,Correspondance de Belgique,1903,82,482,-1
417858,BV038199690,ger,Das Antonioskloster und der Xenon bei der Vierzig-Märtyrer-Kirche in Konstantinopel,2000,82,-221,10
382411,BV038149630,eng,The guilds of Venice,1998,-740,-795,-1
663295,BV038544298,ita,Considerazioni sulla fontana di Arnolfo a Perugia,1960,123,521,-1
1055014,BV047207644,ger,Menschliches Maß und königliche Kunst,2021,-617,599,-1
60227,BV014214303,ger,Aufsichtsratsplanungssysteme,2002,-150,-808,1
859912,BV039689358,ger,Die Camera d'Amore in Avio,2012,-246,169,-1
629442,BV038492983,ger,Kunst und Gesellschaft im Modell der Dreieinigkeitsikone Andrej Rublevs,1977,-411,-325,5
263769,BV037968447,ger,Die römische Campagna,2005,-480,182,14
336973,BV038084970,ita,Il patrimonio artistico di Banca Carige,2008,-452,495,-1
125720,BV037571563,ita,Bernard Damiano,1986,-768,716,-1
1128575,BV047766031,ita,Il periodo romano di Bartolomeo Suardi detto il Bramantino,1914,-41,365,-1
721157,BV038635653,ita,Per il quarto centenario dalla nascita di Paolo Galiari detto Paolo Veronese,1928,521,-378,-1
331532,BV038077078,eng,Rotatory effects in the beheading of Goliath before and after Michelangelo,1997,-260,-234,-1
368860,BV038132807,ita,Arte organaria in Valnerina,1990,-315,730,-1
1168240,BV047894737,ita,Fra Toscana ed Europa,2021,-617,78,-1
815434,BV038849637,ger,Italienische Berichte aus dem spätmittelalterlichen Deutschland,1973,-411,-716,-1
682305,BV038574896,bul,Mnogoplanovost na izobraženieto,1969,754,130,-1
446906,BV038235884,ita,Classicismo e goticismo nell'architettura romana del Cinquecento,1991,-233,-78,-1
220976,BV037899138,ger,Europäische Literatur und lateinisches Mittelalter,1954,-137,-13,-1
247526,BV037944002,ger,Spuren eines byzantinischen Evangeliars,1997,233,495,8
385786,BV038154608,eng,"Anatomia, homo perfectus, and the incorruptibile bodies of saints",2000,164,743,-1
524621,BV038326597,fre,Le grès du Westbau de l'église Saint-Jacques à Liège,1985,96,-365,-1
859246,BV039645402,ger,Putten,2010,-548,508,-1
230899,BV037918999,ita,A proposito di Bernardino Butinone miniatore,2003,246,664,-1
1056969,BV047239252,ita,Formello (Roma),1968,-507,-156,-1
284434,BV038002607,eng,Mainstreaming women's friendship,2006,-54,91,17
822516,BV038871213,ita,Il matrimonio reale di Maria di Modena,1993,466,169,-1
163063,BV037725570,ger,Festgruss für Dr. h. c. Eduard Trautscholdt,1962,-425,-312,5
700140,BV038602978,dut,Post voor Jan van der Heyden,1976,-603,612,-1
648336,BV038522493,ita,Il Battistero di San Salvatore a Barzano,1941,-548,664,-1
119817,BV038963545,ger,Es ist nur ein Rom in der Welt,1977,617,-130,-1
859813,BV039682006,ger,Savigny-Portraits,2011,27,-508,-1
235374,BV037926091,ger,Zur Restaurierung von Kunststoffobjekten,2003,-836,286,-1
850349,BV038948738,ita,Il plafone del Teatro dei Filarmonici di Ascoli Piceno,2010,-521,273,-1
59272,BV014052314,ita,Venere e Amore di Michele di Ridolfo del Ghirlandaio,2001,-233,-130,17
836039,BV038905179,ita,Alberto Magnelli,1964,-274,821,-1
944954,BV043382654,ita,Le compagnie mercantili-bancarie toscane e i mercati finanziari europei tra metà XIII e metà XVI secolo,2015,-192,117,-1
1171770,BV047941018,ita,Dante e la matematica,2021,41,730,-1
170765,BV037741725,dan,H. W. Bissen,1972,397,-156,3
620463,BV038479038,spa,Bóvedas nervadas de tradición musulmana en Torrecilla de Cameros,1977,233,286,13
468561,BV038259168,ita,La chiesetta dei Santi Pietro e Paolo a Centa di Prepotto,1983,-672,234,-1
256419,BV037957415,ita,Considerazioni botaniche su due interessanti erbari veneti quattrocenteschi,2004,-274,-351,18
370848,BV038135183,ita,Massimo Bartolini,1995,-548,247,-1
1033993,BV046836817,ita,Il pittore Giulio Calderone in alcune fonti archivistiche tiburtine (1614-1621),2019,0,247,16
145365,BV037679221,ita,Ti presento la famiglia Medici,2009,521,612,2
76925,BV020916861,ger,Das Selbstbildnis,1931,-699,234,-1
956720,BV043794186,ita,Cultura e filologia di Angelo Poliziano,2016,-342,834,-1
427436,BV038214684,ger,The entire city shall be planned as a Work of Art,2003,1220,860,-1
831420,BV038897010,ger,Die Kunst im Dritten Reich,1976,-246,-586,-1
714626,BV038625689,ita,"Preparazione culturale, apacità critica e metodologica nelle Soprintendenze ai Monumenti",1956,-150,782,-1
305353,BV038035642,ita,La vera origine del capitello a cesto polilobato,2007,-137,-39,-1
45603,BV012165192,rus,Vizantijskaja živopis,1971,13,338,9
276896,BV037990093,ita,Nuovi documenti sulla realizzazione dell'altare del Loretino,2005,-905,-351,-1
1074404,BV047662883,eng,Voicing code in STEM,[2021],-96,-521,-1
134687,BV037627563,eng,The development of Christian worship,1953,-301,-195,7
246225,BV037942234,ita,Il tempietto di Cividale e i nuovi studi,1954,-109,39,17
926894,BV042487858,ita,Santa Maria dei Bisognosi,2010,-315,286,4
710536,BV038619021,ger,Zum korinthisierenden Kapitell in der Blütezeit des Mainzer Rokoko,1966,-96,-756,1
685970,BV038581015,ita,Revisione e precisazione di alcuni reperti archeologici cividalesi,1974,-507,0,-1
502043,BV038297083,ita,Nuovi affreschi di Biagio di Goro Ghezzi,1994,233,26,-1
128290,BV037589800,ger,Hans Weber-Tyrol,2002,-205,26,-1
994915,BV045116910,ita,Realia Christianorum 2,[2018],-438,-534,-1
693816,BV038593857,bul,Prinos kăm izučavane na našata narodna estetika,1970,-850,-13,-1
663833,BV038545189,ger,Unterrichtung über den Ausgang der letzten Mitgliederversammlung des Verbandes Deutscher Kunsthistoriker,1972,-315,52,-1
388395,BV038158194,ita,Un bozzetto inedito di Elia Interguglielmi,[1997],150,-104,-1
971288,BV044338947,ita,Danilo Guerri,marzo 2017,-548,-39,-1
617036,BV038473824,ita,La Seconda Accademia Ambrosiana,1960,-109,534,9
1165191,BV047809779,eng,The future is fat,2022,205,391,8
727017,BV038645066,ger,Einige Daten über Dombaumeister von St. Stephan in Wien,[1955?],41,-78,11
527342,BV038330804,ger,Zur Soziologie der byzantinischen Kreuzkuppelkirche,1968,-329,456,-1
78477,BV021384127,ita,Tra Erasmo e Lutero,2001,-370,182,14
67223,BV017902150,eng,Dante Gabriel Rossetti,1975,480,625,-1
532411,BV038338368,ita,Arte retrospettiva,1900,274,612,-1
970188,BV044307216,ita,Paul Strand e Cesare Zavattini,[2017],-548,-769,-1
293527,BV038016858,ger,"Komme ich wieder einmahl nach Leipzig, wird mein erster Gang zu Ihnen seyn...",2006,-562,495,-1
1030344,BV046763948,dut,De rondzwervingen van Odysseus,[2019],850,-299,-1
386656,BV038155898,ger,Einfachheit als Haltung,1999,397,52,13
947360,BV043490617,fre,Les émaux de Limoges à décor profane,[2016],384,-690,0
589031,BV038429238,ger,Die Renovierung der Pfarrkirche in Haselbach,[1981?],-329,-482,-1
971891,BV044354327,eng,Social media in South India,2017,-411,-456,7
361971,BV038122479,fre,Le tombeau du cardinal d'Aquasparta à Santa Maria in Aracoeli à Rome,2008,233,-260,-1
867561,BV040232886,ita,Arte del corpo,2012,-562,234,-1
267328,BV037974054,ita,Il primo campanile della basilica di Santa Croce a Firenze,2003,-329,169,14
669462,BV038553724,ger,"HAP Grieshaber, Malbriefe",1970,672,260,-1
625109,BV038486336,ger,Die Porzellanfabrik Pirkenhammer bei Karlsbad,1978,356,195,13
566562,BV038390235,ger,Lehrreich Majolika-Ausstellung im Palazzo Venezia,1969,-356,-586,-1
141730,BV037665261,ita,Pit Kroke,1991,68,964,-1
34255,BV008218508,ita,Bologna e il mondo nuovo,1992,507,1016,-1
384178,BV038152122,ita,Gli dei-decani del Salone dei Mesi di Palazzo Schifanoia,1994,246,378,-1
206062,BV037825820,rus,Drevnie goroda podmoskovʹja,1974,-411,534,-1
370432,BV038134677,ita,Santa Veneranda di Gerace,1998,-219,-534,-1
625309,BV038486660,eng,"The furnishings of the Chinese Drawing Room, Carlton House",1967,288,-338,-1
713408,BV038623635,dut,Aert van der Neers 'Rivierlandschap bij maanlicht' apgeheldert,1983,-850,-39,-1
249019,BV037946093,ita,"Accademie, Mediterraneo, fotografia",2004,13,521,9
49108,BV012789395,eng,Nature medicine,1995-,-370,78,-1
319354,BV038058524,eng,A portrait of a young man in black by Pontormo,2008,-534,-703,-1
678704,BV038569052,ita,"Cosimo Fanzago, lombardo a Napoli",1976,27,586,9
328464,BV038072320,fre,Une nouvelle étude pour la Découverte de la louve du Cavalier d'Arpin,2009,-370,782,-1
829921,BV038893769,ita,La fonte di Follonica e le fonti medievali di Siena,2004,-315,-547,-1
762628,BV038691579,eng,"[Rezension von:] Tillberg, Margareta: Coloured univers and the Russian Avant-garde : Matiushin on colour vision in Stalin's Russia 1932. - Stockholm : Stockholm University, 2003",2004,-672,286,-1
417261,BV038199004,eng,Ambrogio Lorenzetti's War and Peace murals revisited,2002,-233,-338,18
595612,BV038440504,ger,Zu einer neuerworbenen Paternosterkette im Schnüttgen-Museum,1971,411,-169,3
214445,BV037860922,ger,Santa Croce Florenz,1933,891,756,-1
721753,BV038636708,eng,Hieroglyphs of death and salvation,1970,315,-391,-1
745873,BV038673600,eng,Some Reflections on Th.W.Adorno's Music Aesthetics,2001,-1412,-834,-1
692176,BV038590904,ger,Der Künstler und Friedenskämpfer Rockwell Kent,1958,-672,-234,-1
525259,BV038327501,fre,Les moulins à Reggio d'Emilie aux XIIe et XIIIe siècle,1979,-850,273,-1
658272,BV038536819,fre,Le Château d'Ooidonk,1984,-96,-703,1
27617,BV005491831,ger,Markt und Macht im Rundfunk,1992,-164,-795,1
238372,BV037930853,ita,Sul restauro in corso a San Giorgio al Velabro a Roma,1994,-644,651,-1
142207,BV037667195,fre,La représentation de l'invisible,2007,54,-65,11
1019889,BV046293131,ita,Sul colle di Villa Revedin,[2019],137,-143,-1
863935,BV039927889,ita,La ricerca archeologica nella corte del Casale a Palagianello,2010,-480,0,7
372042,BV038136670,ita,S. Francesco di Tarquinia nel secolo XVIII,1993,-507,495,-1
240506,BV037933994,ita,"Questo è un libro, questo non é un libro",1999,548,221,-1
412693,BV038192670,ger,Gentlemen never grow old,2001,-82,-716,1
783007,BV038769444,ita,"Trionfo glorioso d'heroi illustri et eminenti dell'inclita et maravigliosa città di Venetia, li quali fiorirono nelle dignità ecclesiastiche, nell'armi et nelle lettere",1629,-274,-91,-1
187640,BV037782710,ita,Adolfo de Carolis,1939,-534,182,14
1022210,BV046358032,ita,Ne sentirai di tutti i colori,2009,-562,-599,5
38576,BV009929830,ger,Denkmaltopographie Bundesrepublik Deutschland,1994,96,260,16
405952,BV038183178,ger,"Spiegel, Spur und Blick",2001,0,664,-1
966127,BV044205477,eng,"[Rezension von: Early Netherlandish painting / Susan Urbach with the collaboration of Ágota Varga. Photographs and technical examinations by András Fáy, 2015]",2017,41,260,16
1005402,BV045480750,eng,Unexplained laughter,[2018],-260,-443,-1
356881,BV038115081,ger,Theater- und Festungsbau,2008,-576,664,-1
173490,BV037748663,lat,In isto opusculo dicit quomodo Romulus [et] Remus nati sunt [et] educati ...,1499,-260,0,-1
267041,BV037973633,ita,La figlia di Iorio nei principali allestimenti scenici,2005,-507,-625,18
333902,BV038080679,eng,Inventing Assyria,1998,-109,-13,17
790,BV000217282,eng,The world of John of Salisbury,1984,-27,-456,-1
129679,BV037600325,ita,Milena Pavlović Barilli,1989,-123,338,9
351393,BV038106154,eng,Music representation and ideology in the paintings of Francisco de Goya and his contemporaries,2009,-164,-769,1
196623,BV037804231,ita,Pittura del giudizio e morte di Michelangelo,1845,-987,-325,-1
885731,BV040807859,ita,Collezionismo e politica culturale nella Calabria vicereale borbonica e postunitaria,2012,672,104,-1
421863,BV038205424,ger,Die Documenta,2002,-68,-886,1
586143,BV038423971,eng,The effect and works of L. C. Tiffany in Hungary,1969,-356,39,-1
293327,BV038016606,ger,Erfahrungen und Probleme bei Erhaltung und Ersatz von älteren Alleebäumen,2006,41,495,-1
124451,BV037565388,eng,Leonardo's incessant Last Supper,2001,-438,-39,7
340180,BV038089864,ita,Interessanti acquisti della Galleria d'Arte Moderna,1962,-548,143,-1
406972,BV038184464,ita,Il tesoro rubato,1998,-425,-573,18
386491,BV038155629,ita,La rosa ed il carciofo tra gli orti e i giardini nel Maceratese,1994,397,-130,3
964679,BV044027645,ita,Mi incanta di sera ma di giorno è un inferno ...,2016,-397,-234,5
519111,BV038318041,spa,Tres pinturas renacentistas valencianas,1954,-205,365,15
43962,BV011640244,eng,In honour of Daryl Lindsay,1964,-384,690,-1
725192,BV038642380,rus,Koptskaja tkan' VI - VIII vekov,1984,342,469,-1
390122,BV038160580,ger,Das Confessionale des Bartholomaeus de Chaimis - ein weit verbreitetes Werk im späten Mittelalter,2000,164,378,8
558104,BV038377055,ger,Fritz Fleer,1953,-41,417,9
943853,BV043324545,ita,Fulvio Rinaldi,[2015],-54,-560,-1
50774,BV012990883,eng,Biorheology,1995-,-370,-495,18
417359,BV038199103,ita,Per una storia della decorazione della basilica fra Quattrocento e Settecento,2002,493,534,2
186786,BV037780854,fre,"Notice des fayences peintes italiennes, hispanomoresques et françaises et des terres cuites émaillées",1864,603,-65,-1
1036190,BV046889285,ger,Geschichtete Identitäten,[2021],192,404,-1
359442,BV038118939,jpn,"The maintenance, repairs and research conducted on the mosaics of the Mausoleum of Galla Placidia",2010,-288,-651,-1
233823,BV037923699,ita,La cattedra - reliquiario del tesoro di S. Marco a Venezia,1955,-82,-1316,-1
496894,BV038291293,ita,Per il Guercino in Romagna,1991,-301,-91,-1
566115,BV038389609,ger,Ein Profangefäss um 1300,1959,-329,847,-1
938069,BV042890464,ita,Edizioni perugine del secolo XVII,2014,370,-52,3
137667,BV037648417,ita,Notizie storiche di Castel Goffredo,2005,342,286,13
244553,BV037939765,ita,Piazza del Mare a Varigotti,2004,315,312,13
86970,BV022354781,ger,Heilungen und Wunder,2007,466,-716,0
1117619,BV047755015,eng,The paintings of Joseph Southall,1917,27,91,16
419178,BV038201420,ger,Ultraschall zum Lokalisieren innerer Schäden,2002,576,612,2
828965,BV038890361,ita,I mosaici pavimentali della cattedrale di Novara,1995,-727,-808,-1
1018174,BV046260083,eng,The funerary couch of An Jia and the art of Sogdian immigrants in sixth-century China,2019,-589,104,-1
827531,BV038887128,ita,Prima di Piero,2001,-589,-573,-1
239554,BV037932470,ita,La loggia di Federico Zuccari a Castelnuovo di Porto,2003,-27,65,16
669161,BV038553335,ger,Die Darstellung von Mariä Himmelfahrt im süddeutschen Barock,1951,-342,-78,7
150957,BV037695978,eng,So ancient yet so new,1998,1508,-221,-1
538274,BV038347471,ita,La struttura urbana di Cittadella alla fine del settecento,1971,246,-404,-1
990489,BV044955936,eng,The Medieval and Renaissance background to Kepler's analysis of spherical lenses,[2018],-13,-365,10
375091,BV038140413,ger,Romanische Weihwassereimer mit Rankenornamentik,1999,-68,521,15
720245,BV038634340,fre,A propos de Sigismondo Coccapani,1981,452,547,-1
238123,BV037930457,ita,La top art di Luigi Malice alla VI Biennale di Arte Contemporanea di Monterosso Calabro,2003,-480,-78,-1
945043,BV043384309,ita,Giovanna Menegazzi,[2015],562,130,-1
984371,BV044759183,ita,Tiziano e la pittura del Cinquecento tra Venezia e Brescia,[2018],329,-951,0
567141,BV038391152,eng,Islands of the wanderers,1981,384,247,-1
510461,BV038306476,ger,Pietro Longhis Taufe,1990,452,0,-1
