,id,lang,title,year,embedding_x,embedding_y,cluster
223193,BV037902630,eng,"Catalogue of important pictures by old masters and portraits of the British schools, the property of the Rt. Hon. Viscount D'Abernon ..., the Rt. Hon. Viscount Lee of fareham, the property of the Rt. Hon. Vicount Powerscourt ... and others",1929,-562,52,-1
62039,BV014773530,eng,"Peasants, pilgrims, and sacred promises",2002,301,-13,12
520072,BV038319391,eng,Profile,1964,521,-351,-1
583809,BV038419781,ita,Museo Nazionale dell'Aquila,1951,-274,65,-1
744070,BV038671217,spa,"Una tabla inédita de La Virgen de la Leche de Juan Sánchez, Maestro de las figuras anchas, en el castillo de Pedraza",1989,-411,299,-1
929991,BV042566429,eng,Nicholas of Cusa and the kairos of modernity,2013,631,534,-1
974334,BV044423802,ita,'Il ratto di Europa',2016,-452,234,14
324801,BV038067008,ita,Ancora sulla Bottega dei Carrega a Porto Maurizio e dintorni nel XVIII secolo,2008,82,247,16
604206,BV038454318,dut,Korte mededeeling over de St. Vincentiuskerk te Zinnik,1934,-164,-351,-1
563105,BV038384772,ger,Emilio Vedova,1956,658,-65,-1
919201,BV042185738,fre,Le cœur économique du complexe épiscopal de Byllis (Albanie) au VIe siècle,2014,-480,-104,-1
771167,BV038703167,eng,"[Rezension von:] Dominici, Bernardo de: Vite de' pittori, scultori ed architetti napoletani. - Napoli : Paparo, 2003 - 2008",2010,-452,-703,-1
458953,BV038248864,ita,L' architettura fortificata nel giardino di Boboli,1990,27,-351,10
534410,BV038341514,fre,Un carnet de dessins d'Henri Evenepoel,1949,-54,-117,17
195388,BV037801238,eng,Leonardo,1880,411,-925,0
232991,BV037922412,ita,I marmi Farnese nel Museo Nazionale di Napoli e le sculture antiche degli Uffizi,1958,576,430,-1
725779,BV038643251,ita,Un codice pisano di fine Duecento,1979,123,260,16
396073,BV038168214,ger,'Der Rasen ist Tisch und Stuhl zugleich' -,2000,-41,-182,16
614776,BV038470400,rus,K voprosu o polichromnom del fte t. n. mufel'nogo obžiga,1967,-329,-430,18
1015035,BV046134060,ita,Fuori città,[2018],-768,221,-1
832754,BV038899686,ita,Mirko,1968,164,-117,-1
327477,BV038070821,ita,Troina medievale,1994,-233,78,16
480742,BV038272555,ita,"Giovanni Battista De Rossi, Luigi Duchesne e l'epitafio di San Siro",1993,521,13,-1
955719,BV043757016,ita,Una galleria dell'arte fiorentina,[2015],-27,-65,16
132679,BV037617072,ita,La collezione degli oggetti in avorio e osso,2004,150,-78,11
454716,BV038244233,ita,Ricerche archeologiche nella pieve di Buja (Friuli),1982,13,-312,16
1005548,BV045483941,ita,Marco Caprinozzi e Francesco Pascucci al servizio dei Nobili Aulici nella chiesa romana di San Lorenzo in Fonte,2018,82,299,16
409128,BV038188044,ita,L' aquila rapace,2000,-233,495,-1
301265,BV038029385,ita,Il crocifisso bronzeo di Vigolo Marchese,2007,397,-52,3
370343,BV038134584,ita,Sul complesso edilizio degli Assonica e sulla loro quadreria,1996,754,104,-1
959891,BV043879486,ita,Suggestioni eraclitee nella poetica di de Chirico,2010,631,325,-1
122782,BV037549129,eng,The Media Lab,1988,-137,117,6
571569,BV038398811,fre,Les galilées des églises monastiques de Déols et de Vouillon,1966,-713,664,-1
446158,BV038235068,ita,La questione del decoro nella struttura urbana,1986,-603,-690,-1
905978,BV041714375,ger,Geschichte in Köln,1978-,-13,625,9
222141,BV037901147,ita,Cento disegni dell'Accademia di Belle Arti di Perugia,1977,-370,-547,18
176842,BV037758364,ita,"La visita erudita dell'insigne basilica della Certosa di Pavia ossia Distinto ragguaglio della medesima, cominciando dalla sua origine sino allo stato presente ...",1817,-164,273,9
409853,BV038188967,ger,Liberalität des Geistes,2001,13,-521,-1
1074948,BV047686644,ita,Un ciclo sulla vita e i miracoli di San Carlo Borromeo a Napoli,2021,-123,-365,-1
620355,BV038478879,eng,Carolus-Duran and the development of Sargent,1963,68,-417,-1
352526,BV038108047,fre,La restauration du triptyque du Saint Sacrement de Dirk Bouts,1998,-137,247,9
21806,BV004310761,ita,Imago lignea,1989,589,677,-1
820590,BV038866712,ita,Storia e figure dell'Apocalisse fra '500 e '600,1996,260,677,-1
194318,BV037798758,ita,Marino Marini,1970,-233,338,4
402,BV000134537,ger,Theseus,1982,-260,-182,7
3785,BV000917315,ger,China,1959,-246,-117,17
708684,BV038616297,ger,Charles Simonds - Schwebende Städte und andere Architekturen ; 14. April bis 21. Mai 1978 ; Städt. Kunstmuseum Bonn,1978,548,-143,-1
194643,BV037799559,ger,Das Reich der Salier 1024 - 1125,1992,-521,-430,5
580296,BV038414054,ger,Das Werk des Architekten Karl Moreau - Die Konstruktionsgebundenheit als Wesensmerkmal der Baukunst,1967,-301,482,-1
173822,BV037749823,ita,José Clemente Orozco,1981,631,508,-1
632048,BV038497078,hun,Ferenczy Noémi falikárpitjai hazai és külföldi kiállításokon az 1920-as években,1984,342,-52,3
1125381,BV047762836,fre,Le portrait de femme de la Galerie Lacaze (Musée du Louvre),1895,631,586,-1
873679,BV040411956,ita,Il centro policulturale di Sant'Agostino,2011,-521,456,-1
609067,BV038461388,spa,"Datos sobre Francisco Hernández y Francisco Giralte, en Madrid",1957,205,599,8
1078120,BV047715502,und,Die Längen- und Hohlmaße in der Münstervorhalle,1913,-68,-130,17
312435,BV038047284,ita,L' Angelo della Pace di Mario Costantini,2008,329,351,8
906259,BV041722161,eng,The Fascist Party and popular opinion in Mussolini's Italy,2012,-493,-743,-1
383435,BV038150908,ita,"Considerazioni sui quadraturisti, pittori prospettici e scenografi a Pavia in età barocchetta",1995,315,156,-1
352492,BV038107975,eng,A venetian pilgrim flask,1966,-603,-13,-1
180153,BV037766973,ita,"Grandezze dell'alma città di Roma antiche, e moderne, come al presente si ritrovano",1637,-68,0,17
225104,BV037904543,eng,Works from the René de Montaigu Collection,1990,82,-117,11
872351,BV040356233,rus,Mif Italii v russkom iskusstve pervoj poloviny XIX veka,2012,-425,-234,5
454306,BV038243776,ger,Die baustatischen Probleme am Bozner Pfarrturm und die strukturelle Konsolidierung anläßlich der Restaurierungsarbeiten 1978 bis 1984,1985,-246,91,16
557504,BV038376190,dut,Het portret van Pompejus Occo door Dirck Jacobsz,1958,493,-169,-1
1071656,BV047608479,eng,A companion to Cosimo I de' Medici,[2022],41,573,-1
549549,BV038363899,ita,Lavori nel canopo di Villa Adriana,1954,-452,547,-1
267395,BV037974173,ita,"La formazione dell'isolato tra via Beccaria e via Passarella, in corso Vittorio Emanuele II",2003,-219,-821,1
532362,BV038338288,fre,Palerme posséde un palais chinois classe demeure de rêve,1971,-27,-508,-1
659845,BV038539395,fre,Les éditions de 1605 et de 1615 du Sénèque lipsien et le tableau dit des Quatre Philosophes de Rubens,1983,288,130,12
31977,BV007273461,ita,La bottega dei Della Robbia,1965,-192,195,6
952513,BV043663459,ita,Sancte Marie de Cripta Maiore a Modugno e San Corrado il Guelfo,[2015],1220,-912,-1
135156,BV037631401,ita,Atmosfere e arredamenti di Giorgio Pes,2005,13,573,9
468247,BV038258822,ita,La Santissima di Coltura e le sacre rappresentazioni,1980,13,-156,16
350034,BV038103879,ita,La chiesa di San Tommaso in Terni,2009,589,-130,-1
702319,BV038606530,eng,Palladio's achievements,1973,-260,391,4
391578,BV038162315,ita,La Madonna di Campagna di Sanmicheli,1995,438,482,-1
171553,BV037743899,ger,Altdeutsche Meisterzeichnungen von Dürer bis Holbein,1942,41,-312,10
671773,BV038557588,ita,La scoperta di un tempietto bizantino del VI sec a Padova,1926,329,821,-1
663418,BV038544475,spa,Vasos renacentistas de cristal de roca en el Museo Lázaro Galdiano,[1980?],452,-52,-1
431143,BV038219284,eng,Two new Madonna and child paintings by Romanino,1986,192,117,12
37710,BV009628234,ger,Der Ragyndrudis-Codex des hl. Bonifatius,1994,548,65,13
188572,BV037784810,eng,The Palladian revival,1994,-562,-834,-1
151041,BV037696153,fre,Fastes militaires du pays de Liège,1970,-493,195,14
273235,BV037984371,ita,Il Romanico di Paolo Verzone,2005,-466,195,-1
129755,BV037600633,ita,Campi Flegrei,2003,-274,-169,7
1151918,BV047789417,ger,"Beiträge zur Geschichte der Liebfrauenkirche, ihrer Plastik und Malerei",1906,-137,-456,-1
38820,BV010013693,ger,Hohenlohe,1995,329,273,13
136941,BV037643943,ita,Enos Malagutti,1989,-411,39,-1
972620,BV044371404,ita,Italo Insolera,[2017],-164,456,4
186502,BV037780357,fre,Niele Toroni,1994,-576,169,-1
610520,BV038463633,ger,Das älteste St. Peter zu Basel,1958,-109,-560,-1
713551,BV038623893,ita,Antonio e Bartolomeo Vivarini,1975,205,625,-1
1028663,BV046725998,ita,Arte romanica in Piemonte,[2019],-534,-312,-1
63600,BV016537215,ger,Bolʹšoj russko-nemeckij slovarʹ,2002,-54,534,15
885562,BV040794843,eng,The path of nature,2013,68,312,16
580308,BV038414098,hun,Frans Hals portréja az augsburgi Städtische Kunstsammlungen-ben,1985,27,-325,10
562647,BV038384020,fre,Meubles et objets d'aujourd'hui,1966,-672,-808,-1
69257,BV018668602,ita,Miracoli dipinti,1967,-137,-247,16
1521,BV000416602,ita,La Sardegna medioevale e moderna,1984,-109,-795,1
940514,BV043042680,eng,Porphyry bathtubs in the sacred space,2015,-178,-52,17
157179,BV037711950,ita,Documenti inediti per una biografia di G. B. Wicar,1936,507,547,2
398047,BV038170881,ita,Un' ipotesi di attribuzione,1999,-96,208,6
12590,BV002059876,fre,Paris et ses environs,1924,-164,404,15
366910,BV038130404,ger,Orte der Ökumene,2010,-54,13,17
929917,BV042566339,eng,Nuel Belnap on indeterminism and free action,[2014],-493,-39,-1
895126,BV041350547,ita,L' ospitale di Oderzo e l'assistenza nel territorio,2012,-219,-351,18
924885,BV042384808,ger,"Verrückt, verrutscht, versetzt",[2015],-192,-143,-1
359774,BV038119398,ita,Firenze 1640,2010,-260,443,-1
562696,BV038384110,ita,Frits van den Berghe,1951,-192,247,15
304422,BV038034129,ita,Ancora sui restauri a palazzo Pitti,1993,-589,-182,-1
848052,BV038943734,ita,L' opera completa di Renoir nel periodo impressionista,1972,315,-417,-1
304412,BV038034119,ita,"La chiesa del Santo Sepolcro, cuore del complesso di S. Stefano",1991,-13,-443,-1
276817,BV037989987,eng,(Mis)placing the muse,2004,-576,-378,-1
377254,BV038143269,ita,Toni Zanussi e le sue Cosmogonie a Nova Gorica,1999,-617,417,-1
317458,BV038055281,ita,Pavia,1994,-219,247,15
668483,BV038552314,ger,Zum Umbau des Schlosses Stolberg/Harz im zweiten Viertel des 16. Jahrhunderts,1991,562,78,-1
311212,BV038045387,ger,Das Zisterzienserkloster Dargun bis um 1300,1998,274,325,13
611993,BV038466010,eng,Finding and fetching visual records,1988,-411,143,-1
635786,BV038502630,ita,La pittura olandese del Seicento in una mostra a Milano,1954,260,338,13
444757,BV038233569,ita,Luigi Veronesi,1990,-329,-39,7
704959,BV038610608,ger,Das byzantinische Erbe der ottonischen Kaiser,1971,452,130,13
700531,BV038603756,eng,Art and property,1982,178,-391,-1
1015761,BV046169606,eng,The woodcut-covered ceiling of the monastery of the Romite Ambrosiane in Varese,[2019],82,13,11
1003477,BV045416782,eng,William Bouguereau,[2018],233,182,-1
254669,BV037954611,eng,Harold Woodbury Parsons,1995,-521,-39,-1
850890,BV038949848,ita,Il teatro a Imola,1994,-315,208,14
985102,BV044794193,ita,Il Cantico delle creature di Francesco d'Assisi,[2017],438,-13,-1
962319,BV043966532,ita,L'abate Luigi Lanzi a Udine (1796-1801),2015,288,-52,12
626909,BV038489162,fre,Van Gogh à Paris,1988,-658,273,-1
1015068,BV046134602,ita,Le vetrate della Cattedrale di Palma di Maiorca,[2019],-932,-378,-1
824000,BV038876958,eng,Collection de monsieur et madame Luigi Anton Laura,2001,233,-156,-1
348765,BV038102099,ita,A proposito della Cattedrale di Trani,1976,-233,677,-1
360842,BV038120935,ger,"Die Burg als Thema, Symbol und Motiv im (Heavy) Metal",2010,-397,-182,5
251431,BV037949900,ita,L' occhio ambiguo del testimone,2004,713,91,-1
124864,BV037567232,ita,La corona di primule,1994,-205,782,-1
581835,BV038416579,ger,Hektor zu Pferde,1964,205,417,8
516402,BV038314213,ger,Mantegna-Gedächtnisausstellung,1956,178,-443,-1
1002325,BV045371015,ita,La basilica di Santa Pudenziana,[2018],-288,338,-1
373901,BV038138918,ita,L'eredità del Fonseca a S. Maria ad Nives di Palazzolo,1997,891,365,-1
815811,BV038850966,ita,La fortificazione del Sasso Simone,1993,-411,-195,5
287414,BV038007046,fre,"Atlas, du mythe cosmologique au mythe géographique",2006,-452,-312,5
542181,BV038353060,fre,Les couronnes du sacre des rois et des reines au trésor de Saint-Denis,1975,-274,-247,-1
304489,BV038034221,ita,Quadri di famiglia,2002,109,1003,-1
272917,BV037983929,ita,Da Costantino a Foca,2004,-246,-13,-1
741620,BV038667477,fre,Le château de la Rochecourbon,1956,-178,782,-1
626115,BV038487756,ita,Il Palio di Siena,1906,370,-625,0
573813,BV038402512,rum,Degradarea operelor de pictură in timpul filmărilor şi fotografierilor,1975,-548,169,-1
369605,BV038133657,fre,Imitation et création,1998,233,234,-1
852730,BV038954024,ger,Das Bild des Künstlers mit Familie,2002,109,117,11
787570,BV038787338,ger,Inventar der Waffensammlung des Bernischen Historischen Museums in Bern,1929,-356,769,-1
61438,BV014570423,ger,Documenta 11 - Plattform 5: Ausstellung,2002,-452,-208,-1
888966,BV041036848,ita,Dalla cappella Contarelli alla dispersa Natività di Palermo,2012,96,-886,-1
177941,BV037761315,ger,Jacques Callot,1958,1028,-208,-1
519521,BV038318616,ger,Nachruf mit Bibliographie,1950,-534,234,14
411774,BV038191366,ita,Pietro Porcinai e la botanica,2002,68,-365,-1
951731,BV043636493,ita,Progetto Giotto,[2016-2017],-1220,990,-1
501457,BV038296431,eng,Bernini in Paris,1992,54,-299,-1
588153,BV038427732,cze,Emauzské ukřižování a jeho restaurace,1963,411,91,13
302167,BV038030875,ger,Zum Verständnis der antiken Statuen in dem Opusculum von Francesco Albertini,1998,-1454,-195,-1
551770,BV038367349,eng,Juan Gris,1984,-713,221,-1
586137,BV038423965,eng,A golden bronze and its model,1974,219,-404,-1
94917,BV035018818,ger,Frucht des Gebetts,1745,397,-234,-1
1045881,BV047111050,ger,Christliche Kunst,2021,27,-404,10
142381,BV037668088,ita,Mario Nigro,[ca. 1991],-233,312,4
353438,BV038109713,ita,Sangallo's Signature,2010,164,39,11
232036,BV037921003,eng,East-west trade and Italian Renaissance art,2003,-507,-756,-1
285683,BV038004446,ger,Die Einwölbung der Kirche St. Peter und Paul in Görlitz (1490 - 1497),2006,-370,130,-1
635903,BV038502763,fre,"Charles-François Viel, architecte de l'hôpital général et Jean-Louis Viel de Saint-Maux, architecte, peintre et avocat au Parlement de Paris",[1967?],521,-1003,0
576215,BV038406708,fre,Poteries de Saint-Porchaire,1975,-205,-573,-1
939943,BV042994070,ita,"Monnot, Livio Odescalchi e il Gladiatore dei Musei Capitolini",2015,-137,638,-1
415028,BV038195756,ita,Una ricostruita Bibbia fiorentina del Quattrocento,2002,150,-469,-1
661019,BV038541194,fre,Verneuil,[1954?],288,-234,-1
739670,BV038664558,fre,Décor byzantin sur quelques vases Zsolnay,1977,205,443,8
636486,BV038503793,ita,La tavolozza di Cennino Cennini,[1979?],-507,-521,7
119071,BV037482590,ger,Hier fiel Mutter vom Esel,2011,-397,-495,18
844655,BV038933609,ger,"Die hinterlassene Gemälde-Sammlung des Herrn Geheimrat Dr. E. Hölscher, Mülheim a. R.",1916,288,599,-1
425104,BV038210739,eng,Orazio Gentileschi's two versions of The Finding of Moses reassessed,1997,480,-834,0
406110,BV038183410,eng,A pastel study for The Death of Sardanapalus by Eugène Delacroix,1995,-576,690,-1
650247,BV038525341,ger,Achte internationale Ausstellung des Surrealismus,1960,-384,247,-1
915225,BV042103429,eng,"[Rezension von:] The letters of Paul Cézanne / edited and translated by Alex Danchev. - 1. publ., London : Thames & Hudson, 2013",2014,-233,599,-1
927092,BV042502740,fre,Faux et pratique de la copie,2014,-1426,-690,-1
1117208,BV047754603,ger,"Höpfingen, Ziegelei wird Gesamtkunstwerk",1998,-219,325,4
507478,BV038303133,eng,'Dolci per Gentile',1989,-768,65,-1
139687,BV037657661,ger,Die Lesbarkeit der Welt,1996,-370,625,-1
731349,BV038651879,ita,Jesolo ed i suoi problemi urbanistici,1966,932,612,-1
24745,BV005120680,eng,The Rosicrucian enlightenment,1974,-534,-104,-1
52372,BV013192516,ger,Der Landschaftsmaler Edmund Steppes (1873 - 1968) und seine Vision einer deutschen Malerei,1999,-82,-325,16
410427,BV038189633,ger,"Eine neu aufgefundene Maria Regina in Santa Susanna, Rom",2002,342,208,13
1047325,BV047143029,ita,La figura di Cristo con il bastone/bacchetta nella rappresentazione dei miracoli sui sarcofagi paleocristiani,2020,-246,430,15
927803,BV042529350,eng,Rococo in Munich,2015,-288,-286,18
1172276,BV047952798,ger,Vom Kollektiv zum Individuum,[2022],-178,-964,1
264922,BV037970488,ger,Procesion vers le stade,2005,631,-13,-1
848036,BV038943694,ita,Gianni Pisani,[ca. 1982],-329,899,-1
1118174,BV047755570,fre,L' émaillerie moderne,1868,1152,-13,-1
160708,BV037720611,spa,La Catedral de Barcelona,1952,-713,-13,-1
641571,BV038511846,eng,Picasso's neo-classicism,1965,-425,286,-1
731998,BV038653008,ita,Le regole del disegno di Alessandro Allori e la nascita del dilettantismo pittorico,1971,-576,-456,-1
1121291,BV047758688,fre,Les vertus théologales grisaille de Raphaël au musée du Vatican,1875,-1440,-182,-1
1047186,BV047140779,eng,Philip II of Spain and the architecture of empire,[2021],260,-495,-1
547067,BV038360097,fre,Delacroix et Auguste Vacquerie,1968,192,247,13
897600,BV041444766,ita,L'Incoronazione dell'Imperatore in San Pietro,2013,-274,-638,-1
505239,BV038300612,ita,"Francesco da Urbino, Romolo Cincinnati e l'ambiente romano di Claudio Tolomei nei rapporti fra Italia e Spagna",1987,246,638,-1
419025,BV038201245,ger,Mailand,1994,548,273,-1
522928,BV038323607,eng,An Augustinian interpretation of Michelangelo's Sistine Ceiling,1979,329,430,-1
251726,BV037950389,ger,Die Spolien von St.Kunibert in Köln,1996,480,104,-1
545405,BV038357561,ita,Sant'Antonio nell'altare maggiore di Donatello al Santo di Padova,1975,562,104,-1
86751,BV022280998,eng,The art of the sacred,2007,-370,-78,7
423604,BV038208117,eng,The pen works of Hendrick Goltzius,1992,1550,-469,-1
702785,BV038607172,eng,Edward Burne-Jones,1976,658,221,-1
278175,BV037991974,eng,Michelangelo's shadow,2005,-466,325,-1
404299,BV038180770,eng,The Cottons at Whittington Court,2001,-329,482,-1
1065571,BV047407028,ita,"Miscellanea di disegni del Cinquecento tra Roma e Lombardia (Cristoforo Caresana, Giovan Paolo Cavagna, Teodoro Ghisi, Luzio Luzzi, Bernardino Malpizzi, Cesare Nebbia, Enea Salmeggia)",2021,-288,599,-1
519048,BV038317943,ger,Kurze Notiz über Verleihung des Conrad-von-Soest-Preises an Fritz Winter,1952,370,-156,3
298061,BV038024094,ita,Una storia dell'arte italiana a più mani?,2006,-960,-351,-1
924730,BV042380379,eng,Ideal parquets and parquetages by Jacques Androuet du Cerceau,2014,192,-456,-1
646549,BV038519630,ita,Maioliche Casteldurantine del sec. XVI per un committente siculo-genovese,1976,-562,365,-1
1061595,BV047306551,ita,Bergamo 1859,2021,-342,182,14
139080,BV037655284,ita,Il Bestiario,2004,658,-91,-1
387191,BV038156597,ita,Piero della Francesca,1996,13,182,16
44055,BV011662055,eng,Drawing the line,1995,-548,456,-1
398889,BV038171919,ita,Dal ritratto all'icona,2000,-548,-716,-1
410100,BV038189274,ger,Franz Marc und Pablo Picasso,1997,13,495,9
214278,BV037859265,ita,Le ricchezze artistiche della Toscana e l'occupazione francese del 1799,1965,82,430,8
145768,BV037680627,eng,Watermarks in Rembrandt's prints,1998,205,365,8
261719,BV037965483,ger,Baukultur,2004,0,-195,16
349800,BV038103563,eng,Carl August Ehrensvärd - draughtsman and architect,1998,82,456,-1
527925,BV038331638,ger,Der Grabstein des Vicarius Hlodericus,1972,-411,-39,7
763566,BV038692800,eng,German post-war printmaking,2005,-109,-821,1
998600,BV045232008,ita,Giovanni Dalmata a Roma,2018,-137,-91,17
337543,BV038086021,ita,Santo Stefano Rotondo,1952,-507,391,-1
565939,BV038389356,ger,Anton Josef und Anton Ferdinand Stratmann als Porträtmaler,1966,-356,195,14
316104,BV038053186,ger,Stoff-Fragmente aus den Reliquienschränken des Kölner Domes,1988,631,169,-1
676217,BV038564827,pol,Badania nad polską sztuką románską w latach,1965,150,312,-1
407356,BV038185431,ita,Il tiburio di Santa Maria della Passione a Milano e Giovan Francesco Gadio,2000,-13,-286,16
1046485,BV047123725,ita,"Filippo Juvarra, regista di corti e capitali dalla Sicilia al Piemonte all'Europa",dicembre 2020,233,-417,-1
654609,BV038531676,eng,John and John Baptist Closterman,1983,370,78,3
425993,BV038212047,ita,Incontri alla galleria Borghese di Roma,2003,-370,-182,5
1151712,BV047789211,ger,Schöffengerichtsordnung von Trier 1400,1872,-315,-78,7
337639,BV038086152,ger,Nachruf auf Otto Mazal,2009,-727,260,-1
415484,BV038196489,ita,30 anni di attività artistica per Gianni Arde,1994,123,547,8
683100,BV038576216,ger,Painting and graphic art at the time of Dürer,1971,-82,-743,1
889479,BV041070441,ita,Profilo del castello e porzione della città di Scilla... in una veduta inedita del XVIII secolo,2007,-397,182,14
725378,BV038642715,ita,Tentativo di interpretazione della discontinuità tra estetica e morale,1957,-301,-169,7
276761,BV037989914,ita,Durante Alberti a Vetralla,2004,-576,-482,-1
592394,BV038435071,eng,Kant and the subjective objects of taste,1967,-480,312,-1
286564,BV038005762,ita,Breve storia di Torre Astura,1994,-905,638,-1
212874,BV037844041,ita,Il Palazzo del Banco di Roma,1950,178,-130,-1
995392,BV045139750,ita,La Campagna romana tra indagine conoscitiva e vedutismo,2017,-425,391,-1
1056943,BV047238935,ita,Bembo e Dante,[2021],219,-247,-1
377305,BV038143320,eng,London,1999,-342,78,-1
410516,BV038189735,slv,Še enkrat o tako imenovanem češkem cestopisu v zbirki Arhiva Republike Slovenije,2001,-150,-286,-1
905379,BV041657627,ita,Regolamenti edilizi e tradizione architettonica,2012,-576,195,-1
240530,BV037934023,ita,Commento ad una serie di disegni del XVI secolo illustranti la Divina Commedia,1963,-123,-469,-1
580269,BV038414007,ger,Residenzen und Hofhaltung der Herzöge von Jülich im 15. und beginnenden 16. Jahrhundert,1995,-301,456,-1
314129,BV038049950,eng,Florence,1963,-233,-312,18
1068753,BV047501026,ita,Manuale di archivistica,settembre 2021,150,-208,-1
1115282,BV047752676,fre,La gravure au Salon de 1864,1864,-68,-338,16
170894,BV037742120,eng,"The Church of the Nativity, Bethlehem",1947,-576,586,-1
32789,BV007588391,ger,Alt-Hollands große Meister,1922,109,-899,-1
119855,BV038963603,ita,Il Camposanto di Pisa,1896,-109,404,15
132326,BV037615560,eng,The Archbishop's Palace Museum,1997,-109,-378,-1
585189,BV038422260,ger,Zum Schaffen der Grazer Malerin Dina Larot,1967,466,-378,-1
719250,BV038632875,eng,The Kabul war,1980,-493,-299,-1
781411,BV038763280,eng,The collector's voice,2000,164,-143,-1
249125,BV037946219,fre,Les achats de peintures d'Auguste III sur le marché de l'art parisien,2003,-1412,-52,-1
888452,BV040991500,eng,"Rome, postmodern narratives of a cityscape",2013,-96,-104,17
888637,BV040998147,ita,La primavera del Rinascimento,2013,-205,-286,-1
960083,BV043882855,ita,Restauri di antiche sculture a Venezia nel XVI secolo,2013,617,417,-1
621263,BV038480270,ger,Ein Gewölberiss des Ulmer Ölbergs,1975,-233,-938,1
306289,BV038037266,ita,"Pitture e sculture nel Broletto di Brescia con particolare riguardo ai secoli XVI, XVII, XVIII e XIX",1970,617,391,-1
290225,BV038011988,ita,Per gli ottant'anni della chiesa di S. Teresa del Bambino Gesù al Pontevecchio,2006,-480,495,-1
690342,BV038587844,eng,An early Christian silver vase,1952,150,52,11
263722,BV037968370,ita,"Bartolomeo Passerotti, il culto di Michelangelo e l'anatomia nell'età di Ulisse Aldrovandi",2004,521,1003,-1
765334,BV038695168,fre,"[Rezension von:] Nancarrow, Mindy; Navarrete Prieto, Benito: Antonio del Castillo. - Madrid : Fundación de Apoyo a la Historia del Arte Hispánico, 2004",2006,384,-273,-1
895510,BV041364621,ita,Forme del legno,2013,-617,-521,-1
43022,BV011347942,ger,Marmor in Rom,1997,-274,-39,-1
254860,BV037954879,ita,L'opera al nero di Alfredo Romano,2004,246,117,-1
568344,BV038393262,eng,Art and criticism,1955,301,-378,-1
721059,BV038635523,ger,Eine Kuppel aus der Alhambra in Granada,1979,-452,-52,7
642890,BV038513930,ita,La parte di Sartoris,1977,-356,821,-1
978,BV000251013,ita,Novelli,1983,-178,599,15
4947,BV001109543,dan,Kirkebygninger og deres udstyr,1934,507,156,-1
643961,BV038515563,eng,Facets of French art,1985,150,-365,-1
974520,BV044426812,ita,Dal seggio abbaziale alla cattedra vescovile,2016,0,-91,16
922100,BV042285767,eng,Still lives,2015,-699,-834,-1
578376,BV038410408,fre,Le centre de documentation et de recherches sur l'histoire de l'art contemporain,1969,-82,-351,16
556489,BV038374556,ita,Le briciole per la cultura,1976,54,-482,-1
1007522,BV045535131,dan,Arkitekterne og historieprojektet,2018,27,-247,16
22323,BV004531215,ita,L' arte per i papi e per i principi nella campagna romana,1990,-13,104,16
100471,BV035644187,eng,Journal of sex & marital therapy,1974-,-137,482,15
194268,BV037798666,ger,Deutsche Landschaft in fünf Jahrhunderten deutscher Malerei,1938,-109,-716,1
43431,BV011460095,ita,Antonio Pigafetta e la letteratura di viaggio nel Cinquecento,1996,-603,-821,-1
698244,BV038600004,eng,Reflections of Narcissus,1966,534,26,-1
987007,BV044881658,ger,Umbildende Erfahrung,2018,-329,664,-1
925204,BV042395067,ita,Alberto Moravia e Pier Paolo Pasolini,2014,164,690,-1
859265,BV039646175,eng,Young Tiepolo,2011,68,338,8
449240,BV038238369,ita,Roma,1987,397,-677,0
256166,BV037956925,pol,Petersburskie przygody Witkacego,2004,-589,26,-1
533262,BV038339793,ger,Das Spätwerk von Paul Klee,1979,-150,104,6
546777,BV038359676,fre,Reconstitution d'un triptyque de Bellegambe,[1962?],-631,586,-1
429180,BV038217085,eng,Raphael and Pintoricchio,1986,123,312,-1
132167,BV037614583,ita,Da Balla alla Transavanguardia,2004,507,-860,0
662871,BV038543695,eng,Eustache Lesueur's critical fortunes,1976,329,247,13
524986,BV038327136,fre,L' Église Saint-Martin de Polignac,1975,-178,-469,-1
1124590,BV047762045,fre,Legs de tableaux fait au Louvre,1882,205,-156,-1
376247,BV038141817,ita,Disegni d'interni di Giuseppe Valadier,1998,-137,-351,16
881916,BV040688061,ita,Restauro e riqualificazione del centro storico di Napoli patrimonio dell'UNESCO tra conservazione e progetto,2012,27,39,16
